compound,negative,neutral,positive,text
0.8957,0.0,0.726,0.274,"Dividend paying stocks like Aventus Group (ASX:AVN) tend to be popular with investors, and for good reason - some research suggests a significant amount of all stock market returns come from reinvested dividends. Yet sometimes, investors buy a popular dividen… [+6556 chars]"
0.9162,0.034,0.683,0.283,"Is AVT Natural Products Limited (NSE:AVTNPL) a good dividend stock? How can we tell? Dividend paying companies with growing earnings can be highly rewarding in the long term. If you are hoping to live on your dividends, it's important to be more stringent wit… [+4838 chars]"
0.5267,0.046,0.816,0.138,"Avnet (AVT) came out with quarterly earnings of $0.60 per share, missing the Zacks Consensus Estimate of $0.65 per share. This compares to earnings of $1.03 per share a year ago. These figures are adjusted for non-recurring items.
This quarterly report repre… [+3149 chars]"
0.2023,0.0,0.954,0.046,"Avnet, Inc. (NASDAQ:AVT) Q1 2020 Earnings Conference Call October 24, 2019 4:30 PM ET
Company Participants
Joe Burke - SVP, Treasury and IR
Bill Amelio - CEO
Tom Liguori - CFO
Phil Gallagher - President, Electronic Components
Conference Call Participant… [+36725 chars]"
0.7902,0.045,0.758,0.197,"World-class money managers like Ken Griffin and Barry Rosenstein only invest their wealthy clients' money after undertaking a rigorous examination of any potential stock. They are particularly successful in this regard when it comes to small-cap stocks, which… [+5691 chars]"
0.4215,0.0,0.917,0.083,"Abstract
Organic photovoltaics (OPVs) have attracted tremendous attention in the field of thin-film solar cells due to their wide range of applications, especially for semitransparent devices. Here, we synthesize a dithiaindacenone-thiophene-benzothiadiazole… [+1477 chars]"
0.0,0.0,1.0,0.0,"PHOENIX--(BUSINESS WIRE)--Avnet, Inc. (Nasdaq: AVT) today announced results for the first quarter ended September 28, 2019.
Fiscal First Quarter Key Financials
<ul><li>
Sales of $4.6 billion were in line with guidance, compared with $5.1 billion a year ago… [+58442 chars]"
-0.6705,0.169,0.762,0.069,"Key Point: You would not have wanted to go to war with these weapons in your hands.
Russia is famous for producing the AK rifle, an amazing design known for its reliability under adverse conditions. However, Russia has also fielded some rifles with questiona… [+6256 chars]"
-0.1063,0.183,0.677,0.139,"Key point: Not every creation is a winner.
Russia is famous for producing the AK rifle, an amazing design known for its reliability under adverse conditions. However, Russia has also fielded some rifles with questionable or just plain bad designs and charact… [+6147 chars]"
0.6956,0.056,0.794,0.15,"Xilinx XLNX is set to report second-quarter fiscal 2020 results on Oct 24.
The companys earnings beat the Zacks Consensus Estimate in three of the trailing four quarters but missed the mark once, the average positive surprise being 6.34%.
For second-quarter… [+4211 chars]"
0.0,0.0,1.0,0.0,"Logitech International S.A. LOGI is scheduled to report second-quarter fiscal 2020 results on Oct 21.
Notably, the companys earnings beat estimates in each of the trailing four quarters, the average being 15.93%.
In the last reported quarter, the companys a… [+4365 chars]"
0.5423,0.045,0.838,0.117,"F5 Networks Inc. FFIV is set to report fourth-quarter fiscal 2019 results on Oct 23.
Although the companys earnings surpassed the Zacks Consensus Estimate in three of the trailing four quarters, the same missed the mark once, the average positive surprise be… [+4186 chars]"
0.5423,0.046,0.835,0.119,"ASGN Incorporated ASGN is set to report third-quarter 2019 results on Oct 23.
The companys earnings surpassed the Zacks Consensus Estimate in one of the trailing four quarters and missed it on other three occasions, the average positive surprise being 1.93%.… [+3842 chars]"
-0.1027,0.053,0.902,0.045,"Amphenol APH is set to report third-quarter 2019 results on Oct 23.
The company projects adjusted earnings between 86 cents and 88 cents per share. The Zacks Consensus Estimate for earnings stayed at 87 cents over the past 30 days.
Notably, the companys ear… [+4271 chars]"
-0.891,0.221,0.779,0.0,"While many of the arterial roads in the city remain in poor condition after the recent spells of rain, interior roads in several residential colonies have taken a severe beating much to the chagrin of the public.
 On Monday, residents of Arumuga Garden, a re… [+1826 chars]"
0.4215,0.0,0.917,0.083,"Abstract
Organic photovoltaics (OPVs) have attracted tremendous attention in the field of thin-film solar cells due to their wide range of applications, especially for semitransparent devices. Here, we synthesize a dithiaindacenone-thiophene-benzothiadiazole… [+1477 chars]"
-0.4215,0.064,0.936,0.0,"Avnet (NASDAQ:AVT) is scheduled to announce Q1 earnings results on Thursday, October 24th, after market close.
The consensus EPS Estimate is $0.65 (-36.9% Y/Y) and the consensus Revenue Estimate is $4.56B (-10.4% Y/Y).
Over the last 2 years, AVT has beaten … [+225 chars]"
0.8689,0.0,0.779,0.221,"Is Blueprint Medicines Corporation (NASDAQ:BPMC) a good place to invest some of your money right now? We can gain invaluable insight to help us answer that question by studying the investment trends of top investors, who employ world-class Ivy League graduate… [+5309 chars]"
0.4767,0.0,0.889,0.111,"PHOENIX--(BUSINESS WIRE)--Leading global technology solutions provider Avnets (Nasdaq: AVT) new wireless edge module, Avnet Guardian 100, adds connectivity to existing equipment quickly and securely. Powered by Microsoft Azure Sphere, Avnet Guardian 100 enabl… [+3869 chars]"
0.4588,0.0,0.892,0.108,"PHOENIX--(BUSINESS WIRE)--Leading global technology solutions provider Avnet (Nasdaq: AVT) is providing customers with the ability to focus more on the software side of their development by launching MaaXBoard, a low-cost, production-ready qualified single bo… [+3325 chars]"
