compound,negative,neutral,positive,text
0.1531,0.037,0.911,0.051,"Illustration by Stephen Shankland/CNET
After four years of development, Brave Software has released version 1.0 of its browser, an iconoclastic product that strips out conventional website advertisements but that can pay you to see other ads the browser itse… [+5606 chars]"
0.7717,0.099,0.695,0.206,"In 2016 Brendan Eich, the controversial creator of the JavaScript programming language and cofounder and former CTO of Mozilla, announced the launch of a new browser called Brave. The pitch was simple but ambitious: Brave would block invasive ads and tracking… [+3649 chars]"
0.0,0.0,1.0,0.0,"Lori Harrison-Kahan is a professor in the English department at Boston College and editor of The Superwoman and Other Writings by Miriam Michelson (Wayne State University Press, 2019). The views expressed here are hers. Read more opinion on CNN.
 (CNN)In the… [+6361 chars]"
0.7184,0.0,0.85,0.15,"A developing technology called blockchain has gotten attention from election officials, startups, and even Democratic presidential candidate Andrew Yang as a potential way to boost voter turnout and public trust in election results.
I study blockchain techno… [+7494 chars]"
0.8858,0.0,0.737,0.263,"The Industrys Most Advanced Browser Offers 3-6x Faster Browsing and Ends Surveillance Capitalism with a Private Ads and Payment Platform that Benefits Users, Advertisers, and Publishers 
Brave Rewards Now Available on iOS, Completing Cross-Platform Availabil… [+7930 chars]"
0.8268,0.0,0.825,0.175,"Your attention is valuable.Thats the reason Facebook and Google are two of the biggest, wealthiest, and most powerful corporations on the planet. But you spend only a small portion of the total value of your attention to get those services social connection a… [+6397 chars]"
0.8442,0.0,0.798,0.202,"The US Securities and Exchange Commission (SEC) has just halted Telegram's massiveand massively hyped$2 billion digital token sale.
Those halcyon days: In early 2018, exuberant investors poured billions of dollars into Telegrams ambitious plan to launch a gl… [+2192 chars]"
-0.1027,0.053,0.902,0.045,"The Telegram Open Network and billions of Gram tokens, as its native currency was meant to go live by 31 October 2019. But the US Securities and Exchange Commission obtained an emergency action on Friday, halting it.
The SEC is bringing a case against Telegr… [+12053 chars]"
0.8176,0.0,0.761,0.239,<ul><li>Brave teams up with blockchain-based encyclopedia Everipedia.</li><li>Braves active users are skyrocketing.</li><li>The market value of Basic Attention Token (BAT) may retrace before it continues rising.</li></ul>Privacy web browser Brave announced a … [+3959 chars]
-0.5829,0.132,0.811,0.057,"Is “time” really the problem with “screen time”? Researchers have described the negative effects of large amounts of time online and the beneficial effect of moderation. For instance, a 2019 study of more than 6,500 12- to 15-year-olds found that more than th… [+4616 chars]"
0.1695,0.0,0.961,0.039,"Facebook(NASDAQ:FB) is facing a lot of pushback for Libra, its proposed cryptocurrency, but that's not stopping the social media giant from forging ahead.
Earlier this week, it announced the 21 founding members of its digital token project at the signing of … [+4139 chars]"
0.0772,0.044,0.905,0.05,"We all know how blockchain is decentralized, it operates all over the world and has no geographical boundaries. Like the internet, you can be part of the conversation regardless of where you are in the world (give or take a few places). 
But depending on whe… [+12128 chars]"
0.3182,0.0,0.949,0.051,"The entire crypto market has turned red today, with Bitcoin (BTC) triggering a slide across most altcoins. But there are two curious exceptions – Chainlink (LINK) and Basic Attention Token (BAT).
LINK and BAT Often Buck the Market Trend
This is not the firs… [+3120 chars]"
0.5719,0.0,0.919,0.081,"Getty
Enterprises that are building on Ethereum have a reason to celebrate, as the new-and-improved Ethereum 2.0 is moving forward. Just a couple of weeks ago, the largest Ethereum development event, DevCon 5, was held in Tokyo and more details about the upc… [+9253 chars]"
0.3818,0.052,0.833,0.114,"<ol><li>
John Roberts Wont Let Mitch McConnell Derail a Trump Impeachment Trial
 </li><li>
What Is This Highly Anticipated FISA Report That Conservatives Keep Talking About?
 </li><li>
This Sure Looks Like Mitt Romneys Secret Twitter Account (Update: It … [+10280 chars]"
0.6808,0.0,0.882,0.118,"Back in 2017, Apple introduced Face ID on the iPhone X. It was the first real biometric facial geometry identification scanner. It couldn't do multiple registrations like Touch ID, but what it did, it did even better — including and especially making authenti… [+16782 chars]"
0.5423,0.054,0.813,0.133,"RollbarWe move fast and fix things because of Rollbar. Resolve errors in minutes. Deploy with confidence. Learn more at rollbar.com/changelog.
DigitalOcean The simplest cloud platform for developers and teams Whether youre running one virtual machine or ten … [+384 chars]"
0.7506,0.058,0.757,0.185,"DigitalOcean DigitalOcean now offers three managed databases PostgreSQL, MySQL, and Redis. Get started for free with a $50 credit. Learn more at do.co/changelog.
The Brave Browser Browse the web up to 8x faster than Chrome and Safari, block ads and trackers … [+360 chars]"
0.0,0.0,1.0,0.0,"Set almost entirely on a cargo ship, Primal is yet another recent low-budget Nic Cage action vehicle in which you can practically see him working out which financial obligations his paycheck will partially cover. As writtenby one Richard Leder, whos spent the… [+3403 chars]"
