compound,negative,neutral,positive,text
0.7845,0.0,0.82,0.18,"Thanks to the laborious stewardship of the blessed Internet Archive and the unyielding armies of Wikipedias citizen scholars, we may, within our lifetimes, reach a consensus on basic historical information.
Last week, the Internet Archive announced that its … [+4857 chars]"
0.7096,0.0,0.872,0.128,"Please note: If you switch to a different device, you may be asked to login again with only your ACS ID.
Please note: If you switch to a different device, you may be asked to login again with only your ACS ID.
Please note: If you switch to a different devic… [+56 chars]"
0.8885,0.0,0.817,0.183,"One of the best investments we can make is in our own knowledge and skill set. With that in mind, this article will work through how we can use Return On Equity (ROE) to better understand a business. By way of learning-by-doing, we'll look at ROE to gain a be… [+4355 chars]"
0.7574,0.0,0.847,0.153,"ST. JULIANS, Malta--(BUSINESS WIRE)--Global cryptocurrency exchange platform, CoinDeal, officially opened the market for their own CoinDeal Token (CDL) on Tuesday 12th November. The innovative new token was claimed, completely free of charge, by over 87,000 C… [+3379 chars]"
0.7351,0.049,0.785,0.166,"The transportation and logistics industry is in the midst of a technological awakening. Customer expectations are following suit. It is no longer enough to just provide excellent service. Now, companies must provide excellent service alongside speed, transpar… [+3575 chars]"
0.0,0.0,1.0,0.0,"CEDAR FALLS Dr. Hong (Jeffrey) Nie, a professor of electrical and electronic technology at University of Northern Iowa, will speak to the Waterloo Technical Society on Wednesday about infrared thermopile sensory arrays.
Infrared thermopile sensor array is an… [+2622 chars]"
0.1531,0.056,0.875,0.069,"Call of Duty: Modern Warfare's biggest patch yet is out now. The free 8-10GB update adds a host of new content to the game and addresses many of the community's biggest complaints regarding the multiplayer portion of the hit first-person shooter.
Krovnik Far… [+8881 chars]"
0.5106,0.0,0.934,0.066,Call of Duty: Modern Warfare's biggest patch yet is out now. The free 1.07 update weighs in at 8-10GB depending on the platform and adds a host of new content to the game (including new maps and a game mode) and addresses many of the community's biggest compl… [+9033 chars]
0.7845,0.0,0.82,0.18,"Thanks to the laborious stewardship of the blessed Internet Archive and the unyielding armies of Wikipedias citizen scholars, we may, within our lifetimes, reach a consensus on basic historical information.
Last week, the Internet Archive announced that its … [+4920 chars]"
-0.5106,0.074,0.926,0.0,"On January 6th, 2020 motor carriers will be required to begin using the Drug and Alcohol Clearinghouse to screen for drivers who are ineligible to operate a commercial motor vehicle based on failing a Department of Transportation (DOT) drug and alcohol test. … [+8317 chars]"
0.7678,0.0,0.84,0.16,"—By Dylan Gilbert
It should go without saying, but its worth shouting from the rooftops every now and then: Libraries are important! While all libraries, from the largest city libraries to the smallest local libraries, provide a diverse array of vital commun… [+9180 chars]"
0.1027,0.031,0.929,0.04,"VATICAN (ChurchMilitant.com) - Pope Francis is apologizing for the furtive removal of the carved fertility figures from a Rome church, and has announced they've been found and will be displayed in St. Peter's Basilica for the Amazon Synod's closing Mass.
""As… [+5096 chars]"
0.6997,0.0,0.851,0.149,"Electrochemical water splitting through the hydrogen evolution reaction (HER) and oxygen evolution reaction (OER) has been regarded as a promising technology that is renewable, sustainable, and ecofriendly.1 Although highly efficient HER electrodes exist, the… [+19282 chars]"
-0.1027,0.137,0.752,0.111,"The latest Call Of Duty: Modern Warfare update nerfs some fan-favorite weapons, makes some other ... [+] balancing tweaks, and adds two free maps.
Credit: Infinity Ward
Todays big Call Of Duty: Modern Warfare makes a ton of changes to the game, while adding… [+19386 chars]"
0.0,0.0,1.0,0.0,"Abstract
Three metalorganic frameworks {[Cd(L)(glu)]·3H2O} (1), {[Cd2(L)2(adi)2]·5H2O} (2) and {[Cd(L)(sub)]·3H2O·DMA } (3) (L = pyridine3,5bis(5azabenzimidazole), H2glu = glutaric acid, H2adi = adipic acid and H2sub = suberic acid) were obtained under solvo… [+837 chars]"
0.6705,0.0,0.866,0.134,"Wilson Logistics (No. 109 on the CCJ Top 250) is petitioning the Federal Motor Carrier Safety Administration to allow its commercial learners permit (CLP) holders who have passed the CDL skills test to drive a truck without a CDL holder in the front seat, eff… [+1023 chars]"
-0.5994,0.083,0.917,0.0,"Skip to comments.
Deserting ChristChurch Militant ^
 | October 29, 2019
 | Christine Niles
Posted on 10/29/2019 4:04:40 PM PDT by ebb tide
In the war of words over Holy Communion, few have been more vocal — on both sides of the fence — than Cdl. Raymond … [+11665 chars]"
-0.6808,0.141,0.859,0.0,"Action in five trucking-related crimes including a CDL testing scheme, medical certification fraud, falsifying daily vehicle inspection reports and a former FMCSA employee charged with theft  has recently been reported by the Department of Transportations Off… [+2862 chars]"
0.7269,0.0,0.835,0.165,The Federal Motor Carrier Safety Administration has launched a website that lists the trucking companies that have been approved to participate in the agency’s Under-21 Military CDL Pilot Program that allows 18-20-year-olds with the military equivalent to a C… [+1183 chars]
