compound,negative,neutral,positive,text
0.5574,0.0,0.903,0.097,"Embrace your dark side.
Or dont. Its really up to you. In the video above, I discuss two big misconceptions about dark mode (battery life improvements and reduced eye strain) and break down why the long-awaited feature might be a bit overrated.
Quick Fix is… [+173 chars]"
0.2732,0.0,0.951,0.049,"Shondaland, the production company founded by “Scandal” and “Grey’s Anatomy” creator Shonda Rhimes, has signed a deal to create a new slate of podcasts for iHeartRadio over the next three years.
As part of the deal, Shondaland is launching a new division cal… [+1437 chars]"
0.0644,0.0,0.97,0.03,"Caffeine, the live streaming service founded by former Apple designers Ben Keighran and Sam Roberts, has signed an exclusive streaming deal with Offset.
The startup has been relatively quiet since raising nearly $150 million in funding last year, but Keighra… [+2155 chars]"
0.1779,0.056,0.847,0.097,"Qoo10, a Singapore-based e-commerce firm has acquired India’s online marketplace ShopClues in an all-stock deal, the two companies said Thursday. The deal, which per a person familiar with the matter valued ShopClues at $100 million, ends years-long struggle … [+1005 chars]"
0.4019,0.0,0.909,0.091,"In the wake of extensive mishandling of user data and a series of securitymissteps, Facebook has deployed a number of security and privacy initiatives. A key focus: expanding its longstanding bug bounty program. Now, Facebook is courting outside hackers more … [+3467 chars]"
0.0,0.0,1.0,0.0,"""You got games on your phone?"" You look down. Yup, there's a preschooler, complete with gigantic doe eyes and a yen for YouTube Kids, clamoring to grab your thousand-dollar slab of glass with his or her mysteriously sticky fingers and still-wonky motor skills… [+2019 chars]"
0.8011,0.0,0.862,0.138,"Like any sort of vehicle rental, the pricing for moving trucks isnt always what it seems. Youll see a great dealMoves from $19.95! or Reserve for just $20!but inevitably, when you call to actually make that reservation, it turns out the cost is often twice th… [+3870 chars]"
0.765,0.0,0.867,0.133,"If youre a Spotify Premium user, the company has something for you: a free Google Home Mini. The deal works for both existing users and new users that sign up today.
Spotify announced its bringing back its free Google Home Mini promotion today. Starting toda… [+632 chars]"
0.8363,0.041,0.736,0.223,"If youre unsure whether youre finding the absolute best deal for a flightand want to better understand all of your optionsGoogle Flights just rolled out a new update thatll make finding cheap airfare a little easier.
Using Google Flights, you mayalready have… [+1232 chars]"
0.0,0.0,1.0,0.0,"18 body joints, comin right up
Adobe
Adobe is previewing an R&amp;D feature for After Effects that can automatically track human movements and apply them to animations. The body tracker detects human body movement in source videos to generate track points f… [+1999 chars]"
0.0,0.0,1.0,0.0,Chat with us in Facebook Messenger. Find out what's happening in the world as it unfolds.
0.7351,0.0,0.866,0.134,"Image copyrightPA Media
A Brexit deal has been agreed between UK and EU negotiating teams before a meeting of European leaders in Brussels. 
Prime Minister Boris Johnson tweeted: ""We've got a great new deal that takes back control.""
The two sides have been… [+559 chars]"
0.7096,0.032,0.81,0.158,"New York (CNN Business)Negotiators from General Motors and the United Auto Workers union have reached a tentative deal to end a 31-day strike by nearly 50,000 workers.
Details of the agreement were not immediately available. The deal was confirmed by Terry D… [+603 chars]"
-0.3818,0.103,0.843,0.054,"Trump said the Islamic State used the internet better than almost anybody in the world, perhaps other than Donald Trump. And he said hed warned the world about the threat posed by bin Laden in a book published in 2000.We looked at your 2000 book, The America … [+1166 chars]"
0.1779,0.048,0.848,0.103,"Disney and Amazon have made up
Disney+ will be available on Amazon Fire TV devices for the November 12th launch after all, according to The Wall Street Journal, following a WSJ report last month that said the streaming service may not be available on Amazon … [+1066 chars]"
0.3058,0.046,0.858,0.096,"Bookmark Kinja Deals and follow us on Twitter to never miss a deal.
Burgeoning audiophiles, rejoice. Drop (formerly MassDrop) and Sennheiser combined forces to give you the HD 58X Jubilee Headphones, a $135 pair of open-back headphones, down from the usual $… [+23009 chars]"
0.128,0.049,0.891,0.06,"Illustration by Alex Castro / The Verge Google parent company Alphabet is in talks to buy wearable company Fitbit, Reuters reports. There is currently no confirmation that the deal will definitely take place, according to sources familiar with the talks. Goog… [+73 chars]"
-0.1531,0.111,0.747,0.143,"Image copyrightAFPImage caption
 Woody Allen had filed a $68m (£52m) lawsuit over the termination of his contract with Amazon
Woody Allen has reached a legal settlement with Amazon Studios after it abandoned a four-film deal.
Allen initially filed a $68m (… [+2062 chars]"
0.3612,0.032,0.885,0.082,"Last week, we discussed how to deal with tricky job interviews and the right way to answer why exactly do you want to work here? (Spoiler: its a lot easier than you think.) In our comments section, one reader mentioned another potential scenario you might run… [+5375 chars]"
-0.4215,0.14,0.767,0.093,"Stress is something we all have at some point, the difference is in how we deal with it. While its definitely easy to let stress slow us down or even cripple us when it comes to completing tasks. This week Fast Company published a story on stress and made a f… [+859 chars]"
