compound,negative,neutral,positive,text
0.3182,0.0,0.944,0.056,"Update 10/25: We have opened this issue for further discussion on this topic. Please direct your feedback there: gitlab-com/www-gitlab-com#5672
Update 10/24/19:
We've heard your concerns and questions and have rolled back any changes to our Terms of Service… [+3319 chars]"
0.4215,0.0,0.944,0.056,"Who owns data owns the world. And with the Internet taking over much of our daily lives, it has become far easier and faster to receive, collect, and analyze data.
The average user cannot even imagine how much data gets collected on them. Besides technical i… [+14263 chars]"
0.0772,0.107,0.78,0.113,"This is a breaking news story and will be updated throughout the night.
Severe storms developed in the Dallas-Fort Wort metro area Sunday night bringing hail, lightning and at least one confirmed tornado, north of Dallas Love Field. 
RELATED: Severe thunder… [+2449 chars]"
0.8225,0.0,0.842,0.158,"After engineering its own growth, can the Dallas suburb stay on top? It’s one of the fastest-growing cities in the nation. It was named the best place to live in America by Money magazine in 2018. It’s the headquarters of the Dallas Cowboys and soon the Profe… [+13542 chars]"
0.34,0.0,0.938,0.062,"Abstract
Bimolecular photoinduced electron transfer (PET) from excited state CdTe quantum dot (QD*) to an electron deficient molecule 2,4dinitrotoluene (DNT) is studied in toluene. We observed two types of QDDNT complex formations; (i)nonemissive complex, in… [+1249 chars]"
-0.2263,0.049,0.951,0.0,"Gujarat Chief Minister Vijay Rupani
People from the Nomadic Tribes &amp; Denotified Tribes (NT-DNT) on Thursday demanded separate reservation for them, bifurcated from the 27% reservation for OBC (Other Backward Classes) communities, in their interaction wit… [+3475 chars]"
-0.296,0.055,0.945,0.0,"With DoubleClick, Analytics and AdWords under its belt, Google continues dominating when it comes to global data collection for advertising, a new report found.When it comes to data collection, Google’s combined arsenal of advertising tools and services conti… [+6696 chars]"
-0.4019,0.057,0.943,0.0,"Rapper Lil Reese was critically injured Monday after he was after he was shot in the neck about 26 miles from Chicago.
Police told ABC7 Chicago that officers received reports of a shooting in Country Club Hills, Illinois at 167th Street and Pulaski Road.
Po… [+2122 chars]"
0.128,0.0,0.903,0.097,"ConcurrentHashMapHashMap // // ConcurrentMap -&gt; Map -&gt; Entrypublic class ConcurrentHashMap&lt;K,V&gt; extends AbstractMap&lt;K,V&gt; implements ConcurrentMap&lt;K,V&gt;, Seri......"
0.8555,0.042,0.731,0.227,"As Legend of the Galactic Heroes charges headlong through its second phase, it's interesting to note how streamlined the story becomes between all its myriad adaptations by this point. The original LoGHOVA had some pretty distinct differences from the source … [+5514 chars]"
0.0,0.0,1.0,0.0,"Introduction
Background
The major transformation pathways of 2,4,6-trinitrotoluene (TNT) released into the environment include microbial reduction, metal catalyzed abiotic reduction, and photolysis, depending on the individual soil, sediment, or aquatic mat… [+88655 chars]"
0.128,0.0,0.964,0.036,"JD Supra Privacy Policy
JD Supra is a legal publishing service that connects experts and their content with broader audiences of professionals, journalists and associations. 
This Privacy Policy describes how JD Supra, LLC (""JD Supra"" or ""we,"" ""us,"" or ""our… [+20257 chars]"
0.128,0.067,0.831,0.101,"GitLab has put the brakes on plans to introduce forced tracking by third-party telemetry services by changing its Terms of Service. 
GitLab is a DevOps platform, delivered as a web application for purposes including management, code creation, security, and p… [+3999 chars]"
0.4215,0.0,0.944,0.056,"Who owns data owns the world. And with the Internet taking over much of our daily lives, it has become far easier and faster to receive, collect, and analyze data.
The average user cannot even imagine how much data gets collected on them. Besides technical i… [+14293 chars]"
0.4215,0.0,0.944,0.056,"Who owns data owns the world. And with the Internet taking over much of our daily lives, it has become far easier and faster to receive, collect, and analyze data.
The average user cannot even imagine how much data gets collected on them. Besides technical i… [+14330 chars]"
-0.8442,0.178,0.822,0.0,"A man who was wrongly convicted of rape after police missed crucial Facebook message evidence has been refused compensation for spending more than two years in jail.
Danny Kay had his conviction quashed in 2017 when the Court of Appeal ruled police had relie… [+2531 chars]"
-0.8442,0.197,0.803,0.0,"World / 4 November 2019, 07:49am / JONATHAN BUCKS
File picture: Pexels
London - A man who was wrongly convicted of rape after police missed crucial Facebook message evidence has been refused compensation for spending more than two years in jail.
Danny Kay … [+2352 chars]"
-0.25,0.094,0.855,0.051,"while migrating my existing database engine from SlqlLite to MongoDB through djongo ( a django ODM), I am facing this issue of key error, which simply means when a key and its associated value is not present in the dictionary of constraints, I am suspecting i… [+696 chars]"
