compound,negative,neutral,positive,text
0.7717,0.099,0.695,0.206,"In 2016 Brendan Eich, the controversial creator of the JavaScript programming language and cofounder and former CTO of Mozilla, announced the launch of a new browser called Brave. The pitch was simple but ambitious: Brave would block invasive ads and tracking… [+3649 chars]"
0.0258,0.093,0.813,0.095,"The crucial question becomes: Do the people in the encounter feel secure enough to learn from it rather than to react with anxiety and fear? Right now, we are asking millions of Americans to accept high immigration while they are already living with maximum i… [+1833 chars]"
0.1027,0.046,0.9,0.054,"The first thing you'll notice is that the cheaper model looks... a bit different than your typical set-top box. It's a cylinder that's meant to sit among the wires behind your TV. According to NVIDIA, that helps it avoid wireless interference. And if WiFi str… [+1635 chars]"
0.1531,0.045,0.898,0.057,"Over the years, we've been adding things to our airplanes such as situational awareness tools and things that simplify control or lower pilot workload, Bergwall says. But now, for the first time, we actually have a safety system that is really just for the pa… [+2975 chars]"
0.3818,0.0,0.929,0.071,"Almost all of them consistently and pointedly played music by the absent Pop Smoke, who has had a handful of rowdy hits this summer. Rolling Louds New York debut in part was going to be a showcase for new talent from the city, but the N.Y.P.D.s request laid w… [+876 chars]"
-0.25,0.056,0.911,0.033,"My judgement in investment was not right in many ways.
An actual slide from SoftBanks earnings presentation.
Image: SoftBank
SoftBank leader Masayoshi Son admitted that it was a mistake to have invested in WeWork, the beleaguered office space rental compan… [+1718 chars]"
0.802,0.049,0.746,0.205,"Hey everyone. Thank you for welcoming me into you inbox yet again.
Last week, I talked about the eternal dumbness of the smart home and how Google had a big chance to lay out their vision this past week. Guess what? They did not, instead we got a new more ex… [+4633 chars]"
0.7906,0.057,0.728,0.215,"In the two years since Sidewalk Labs pitched its vision for a grand smart city development — encompassing an entire neighborhood on the Toronto waterfront — the project has been beset by controversy and criticism.
On one hand, the 12-acre project in Toronto’… [+4348 chars]"
0.875,0.0,0.733,0.267,The chipmaker also unveiled a next-gen Movidius Vision Processing Unit whose updated computer vision architecture promises over 10 times the inference performance while reportedly managing efficiency six times better than rivals. Those claims have yet to pan … [+710 chars]
-0.8638,0.206,0.794,0.0,"I continued to cry intermittently for the next couple of weeks. I took in Central Park from my terrace. I could see individual leaves rustle in the wind. Tears. I looked down at my dining room carpet, it was so dirty. I burst into tears.
I walked across the … [+1143 chars]"
0.128,0.0,0.959,0.041,"4 with 3 posters participating
<ul><li>
 The hardware you get with the $129.99 Stadia ""Founder's Edition."" 
</li><li>
 Close-up of the exclusive Founder's Edition Controller. 
</li><li>
</li><li>
 Extra Stadia Controllers will be available for $69 in t… [+2714 chars]"
-0.4404,0.083,0.874,0.043,"The Current War.""/&gt;
 Enlarge/ ""My boys and I caught in a jar what before now has only flashed across the night sky."" Benedict Cumberbatch plays Thomas Edison in The Current War.
0 with 0 posters participating
Before Macs vs. PCs, before Elon Musk and Je… [+9421 chars]"
0.8658,0.0,0.819,0.181,"Andrew Wilson:
That will include our plans for NBA LIVE. With great support from the NBA and NBPA, we had been working on an innovative new direction for our game timed with the All-Star weekend – an experience designed around new ways for players to engage,… [+1663 chars]"
0.6199,0.088,0.748,0.164,"Jaguar knows how to design a pretty car, and even a handsome EVthe I-Pace is a looker, says us, and whod dare disagree? But Jags young team of designers has outdone itself here. This is the Vision Gran Turismo Coupe and well...rawr, eh? A classically low, lon… [+1820 chars]"
-0.7184,0.115,0.885,0.0,"A new Android device just took the streaming wars to another level. 
With the release of the Shield TV and Shield TV Pro, NVIDIA is trying to show it can stand toe-to-toe with Amazon's Fire Stick and Roku. Both devices boast the new Tegra X1+ processor which… [+1326 chars]"
-0.6808,0.296,0.583,0.121,"The concept is gorgeous, but the real tragedy is that it'll never get built."
0.4336,0.0,0.921,0.079,"It might also be easier to talk to a visitor. Arlo's model pushes a live video call to your phone the moment someone presses the doorbell, so your guest is less likely to leave while you're fumbling around with an app. You'll have other modern creature comfor… [+628 chars]"
0.34,0.04,0.869,0.091,"Persistence of Vision (POV) is a curious part of the human visual system. It’s the effect by which the perception of an image lingers after light has stopped entering the eye. It’s why a spinning propeller appears as a disc, and why a burning sparkler appears… [+6591 chars]"
-0.7579,0.165,0.835,0.0,"But we live in actual America. In actual America, efforts to eliminate tipping have generally failed. Voters in Maine and Washington, D.C., passed ballot measures to phase out tipping. Both decisions were overturned after protest and confusion. Restaurants th… [+2351 chars]"
