compound,negative,neutral,positive,text
0.4019,0.0,0.935,0.065,"More posts by this contributor
Recently reelected, Indonesian President Joko Widodo announceda desire to move the nation’s capital from Jakarta to the East Kalimantan region, citing environmental concerns, the most exigent of these being the fact that Jakart… [+3213 chars]"
0.4215,0.0,0.939,0.061,"Google hopes Android 10 upgrades will happen noticeably sooner this year
Photo by Amelia Holowaty Krales / The Verge
Google is announcing that last years version of Android, Android 9, accounted for 22.6 percent of the ecosystem as of this past August. That… [+2263 chars]"
0.8402,0.0,0.83,0.17,"Apple TV Plus launches on Friday, November 1, and though the $5 monthly price tag and slowly-expanding device support make it an easy sell for the passionate Apple fans out there, those who havent already bought into the wider Apple ecosystem may need some co… [+3786 chars]"
0.946,0.039,0.617,0.344,"We talk a lot about startup ecosystems around these parts, and for good reason. Strong ecosystems have great reservoirs of talent congregated close together, a culture built around helping one another on ambitious projects, and sufficient risk capital to ensu… [+7307 chars]"
0.3612,0.0,0.937,0.063,"Software development companies tackling services for niche industries, like commercial real estate subcontracting, continue to find Los Angeles to be fertile ground for development.
The latest company to raise funding from a clutch of investors is BuildOps, … [+2599 chars]"
0.3818,0.0,0.942,0.058,"EV Connect, the Los Angeles-based company that sells software to manage electric vehicle charging, has raised $12 million in a Series B round led by investors Mitsui &amp; Co. and Ecosystem Integrity Fund.
The company has raised $25 million to date.
EV Conn… [+1765 chars]"
0.7089,0.0,0.879,0.121,"For many years the allure of Silicon Valley was contingent on the ability to move here. Its ecosystem didn’t work remotely. “We see a very strong indication that where you’re located does matter… come to Silicon Valley,” intoned Joe Kraus of Google Ventures a… [+2732 chars]"
0.5106,0.061,0.784,0.155,"The Plug and Play network of accelerator programs is partnering with the non-profit organization The Alliance to End Plastic Waste to create an accelerator focused on developing technologies to reduce, remove or replace plastics in the industrial ecosystem.
… [+2054 chars]"
0.6369,0.0,0.915,0.085,"With two months of 2019 still to go, Indian tech startups are already having their best year as a record amount of capital flows into the local ecosystem in a major rebound since the darkened funding environment of 2016.
The unlisted tech startups in India h… [+3590 chars]"
0.7713,0.0,0.871,0.129,"When we introduced Wear OS by Google (then called Android Wear) five years ago, wearable tech was pretty nascent. 
While it was early, we felt there was something really exciting about this next era of computing and we wanted to enable an ecosystem of partne… [+784 chars]"
0.5499,0.0,0.898,0.102,"And then there are the actors. Most Americans probably wouldnt recognize Kirby Heybornes blond waves but many Latter-day Saints do. Along with a number of national commercials, including a Snickers spot with Mr. T, Heyborne has played Elder Calhoun in The Bes… [+1262 chars]"
0.0,0.0,1.0,0.0,"November
8, 2019
5 min read
Opinions expressed by Entrepreneur contributors are their own.
Everywhere you go, you’re in or around an ecosystem. Whether that term is referring to your company’s HR department, a group of products or services or even an enti… [+5504 chars]"
0.0,0.0,1.0,0.0,"Opinion, advice, and analysis by the TNW community
Story by
Conrad Egusa
CEO, Publicize &amp; Espacio Media Incubator —
 Conrad lives in Medellin &amp; NYC and profiles startup ecosystems during his travels. He is a Global Mentor at 500 Startups, Techstar… [+11949 chars]"
0.1779,0.0,0.956,0.044,Barbershops and salons in the U.S. represent a $315 billion industry counting nearly 3 million small businesses and 4 million independent aestheticians among their ranks. It’s a business that has been slow to adopt modern technologies because it’s both specia… [+2121 chars]
0.8059,0.0,0.803,0.197,"While the Echo lacks the smart hub features from the Pro model, I didn't miss them much. Previously, the biggest benefit with the more expensive model was better audio quality, but now that they sound the same, the Pro is even harder to recommend. I didn't fi… [+3117 chars]"
0.7717,0.0,0.848,0.152,"Some phones look to impress with an abundance of tech, while others promise simplicity and a tightly knit ecosystem. But when it comes to Pixel phones, Google leans on its expertise in software. Last year, it felt like things finally came together on the Pixe… [+12304 chars]"
0.0,0.0,1.0,0.0,"India now hosts the third largest startup ecosystem in the world, stated Prime Minister Narendra Modi. Speaking at his keynote at the Future Investment Initiative (FII) in Riyadh, Saudi Arabia, PM Modi was quoted by news agency Asian News International as say… [+2336 chars]"
-0.1779,0.067,0.879,0.053,"Only a few years ago, Microsoft hoped that Cortana could become a viable competitor to the Google Assistant, Alexa and Siri . Over time, as Cortana failed to make a dent in the marketplace (do you ever remember that Cortana is built into your Windows 10 machi… [+1172 chars]"
-0.296,0.052,0.948,0.0,"From a geographical perspective, the San Francisco Bay Area and Los Angeles startup ecosystems are no longer separated by a few hundred miles.
Top-tier VCs from SF visit LA regularly, and entrepreneurs raise from investors upstate and downstate in one proces… [+3472 chars]"
0.8268,0.0,0.841,0.159,"Its like 99 cents more!
You can now subscribe to your favorite streamers from your iOS device, provided you have an iOS device and have updated the Twitch app. Truly we are living in the future. 
Twitch announced the news at this years TwitchCon in San Dieg… [+1192 chars]"
