compound,negative,neutral,positive,text
0.128,0.068,0.835,0.097,"Here at Overboard, we like two things: lying to eachothers faces and decipheringmysterious clues. Thats why the moment we heard of Obscurio, a mixture of Mysteriums image based clues and classic hidden traitor mechanics, we knew we had to play it. And more im… [+2517 chars]"
0.4215,0.0,0.941,0.059,"On Sunday, I went to the flea market, and found exactly what I was hoping for: a big pile of cheap video games. In this case, it was a bin full of somebodys collection of big-box 1990s PC games, adult-owned, in mint condition. I suddenly found myself the owne… [+6431 chars]"
0.4215,0.053,0.853,0.094,"In 2017, genre-defying Nashville duo Hammock released their eighth album, Mysterium; a towering, wordless masterpiece that centered itself around the notion of loss. The album served as a memorial to Clark Kern, a son-like figure to Hammock co-founder Marc By… [+2974 chars]"
0.5994,0.0,0.902,0.098,"When SyFy canceled The Expanse in May 2018, it was fans of the show who came together to try and save it. That effort culminated in renting a plane to fly a banner over Amazon Prime headquarters. Eventually Jeff Bezos himself took notice, stepping in to give … [+3801 chars]"
0.9504,0.0,0.698,0.302,"Traditionally most board games worked best for smaller groups. But more and more awesome tabletop experiences are coming out that cleanly and elegantly scale up to 10 or even more players, giving everyone something to do, a specific role to play, keeping peop… [+13361 chars]"
0.9652,0.0,0.646,0.354,"Share this article
Companies in this article
Reboot Develop
Streamline Studios' Bake 'n' Switch won three awards at Reboot Develop Red, including the coveted Game of the Year prize.
It also picked up Outstanding Gameplay and Visual Excellence at the Indie… [+940 chars]"
0.7506,0.0,0.814,0.186,"hotukdealsPart of Pepper - The World's Largest Deal Community
hotukdeals is a community for deal seekers. Find and share the best deals, promotional codes and vouchers from on and off the web."
-0.6249,0.188,0.685,0.127,"Into the Radius VR is a single-player VR shooter headed to Steam Early Access next month. Created by Estonia-based indie studio CM Games, the horror survival game promises a dark mix of horror, open-world exploration, realistic weapon handling, and plenty of … [+1471 chars]"
-0.5106,0.084,0.916,0.0,"(Reuters) - The San Francisco startup that invented the groundbreaking Juul e-cigarette had a central goal during its development: captivating users with the first hit. 
The company had concluded that consumers had largely rejected earlier e-cigarettes, form… [+31437 chars]"
0.296,0.0,0.949,0.051,"Share this article
Companies in this article
Reboot Develop
Campo Santo co-founder Chris Remo, Apocalypse Studios founder Denis Dyack, and prolific composer Austin Wintory have all joined the line-up for Reboot Develop Red.
Chris Remo was one of the origi… [+2343 chars]"
-0.5106,0.084,0.916,0.0,"The San Francisco startup that invented the groundbreaking Juul e-cigarette had a central goal during its development: captivating users with the first hit.
The company had concluded that consumers had largely rejected earlier e-cigarettes, former employees … [+32364 chars]"
-0.8126,0.192,0.736,0.072,"Former Juul employee Chenyue Xing launched her own vape startup, Myst Labs. Myst Labs
The scientist responsible for bringing Juul to the world says the current vaping crisis is an unfortunate accident on the companys part.
In an appearance on Bloombergs pod… [+2195 chars]"
-0.6908,0.21,0.661,0.129,"Some problems exist for so long they become normal. Some, like Microsoft’s Blue Screen of Death, become a meme. App cloning and outright fakes that masquerade as legitimate apps in the Google Play Store are problems like this. Clones are everywhere in the Pla… [+10312 chars]"
0.4215,0.0,0.941,0.059,"On Sunday, I went to the flea market, and found exactly what I was hoping for: a big pile of cheap video games. In this case, it was a bin full of somebodys collection of big-box 1990s PC games, adult-owned, in mint condition. I suddenly found myself the owne… [+6432 chars]"
-0.2656,0.102,0.817,0.081,"The most troubling part of all this is that I actually liked being in Afghanistan. I didnt want to leave. For the first year or so after we got back, I spoke openly and bluntly about the experience. Eventually, however, I started to notice a pattern: Whenever… [+5791 chars]"
-0.0772,0.029,0.971,0.0,"Former Bungie CEO, Harold Ryan, has unveiled his new development company that has been operating in stealth mode since 2016. ProbablyMonsters Inc. already has two studios working on brand new AAA IPs with 70 full-time staff members and counting, and has alrea… [+1369 chars]"
0.2023,0.075,0.801,0.124,"Ask MetaFilter is a question and answer site that covers nearly any question on earth, where members help each other solve problems. Ask MetaFilter is where thousands of life's little questions are answered."
0.886,0.0,0.785,0.215,"I came to The Starless Sea not having read The Night Circus, Erin Morgenstern's fantastically successful 2012 debut. Curiously, though, I felt as if I had, and even as if I'd enjoyed it likely, on reflection, through a combination of the gorgeously evocative … [+3615 chars]"
0.2263,0.055,0.892,0.053,"Caroline, what kind of wizard are you? It’s hard to make it through Pang without repeatedly asking that question. 
For a while, it seemed like Caroline Polachek’s main magic trick was disappearing. After Chairlift hung it up, she seemed to vanish into the Lo… [+3022 chars]"
