compound,negative,neutral,positive,text
0.0,0.086,0.828,0.086,"Image source: The Motley Fool.
NewMarket (NYSE:NEU)Q3 2019 Earnings CallOct 24, 2019, 3:00 p.m. ET
Contents:
<ul><li>Prepared Remarks</li><li>Questions and Answers</li><li>Call Participants</li></ul>Prepared Remarks:
Operator
Ladies and gentlemen, good d… [+13817 chars]"
-0.0286,0.024,0.976,0.0,"Collier pursues her own version of this dot theory in her new works, but crucially she also recognizes that this is not only a matter of the conjunction of two disparate visual technologies; it is also that of two regimes of image replication and disseminatio… [+2004 chars]"
0.9246,0.0,0.744,0.256,"Indian Super League 2019 Live Streaming: NEUFC in training (Source: NEUFC Twitter)
Indian Super League 2019 Live Streaming, NorthEast United vs Odisha Live Score Streaming Online: NorthEast United FC host Odisha FC in their first home match of the Indian Sup… [+1312 chars]"
0.9168,0.0,0.725,0.275,"This week, Stereogum are media partners at Berlin’s intimate psych-rock festival Synästhesie. To celebrate, we’re looking back on a pivotal, deeply influential genre from Germany.
For a corner of popular music that revolutionized multiple genres at once from… [+27977 chars]"
0.8689,0.0,0.758,0.242,"Hedge fund managers like David Einhorn, Bill Ackman, or Carl Icahn became billionaires through reaping large profits for their investors, which is why piggybacking their stock picks may provide us with significant returns as well. Many hedge funds, like Paul … [+5106 chars]"
-0.9601,0.325,0.675,0.0,"RandaleHerbert14.10.2019 12:56Find die auch gut. Haben ordentlich Bass, nicht so sauber wie die Hybrids Find die auch gut. Haben ordentlich Bass, nicht so sauber wie die Hybrids oder Pistons, aber bei dem Preis kann man nicht meckern.Hab aber ein Problem mit … [+260 chars]"
-0.3818,0.08,0.92,0.0,"CDK2-mediated EZH2 phosphorylation drives tumorigenesis
To examine whether expression of CDK2-activated EZH2 in mammary glands contributes to basal-like mammary tumor development, we established a transgenic mouse model expressing phospho-mimicking EZH2T416D… [+32217 chars]"
0.0,0.0,1.0,0.0,"The SoCal Vintage BMW Meet is always the first Saturday in November. The show is open to all Vintage BMWs from 1989 back, including all cars to the end of those models production runs (E34,E32,E31,E30, E28, E26, E24, E23, E21, E20, E12, E9, E6, E3, 2002, Neu … [+588 chars]"
0.4404,0.0,0.902,0.098,"Anne Collier
""At this level of enlargement, we become engrossed by the details of the printing process itself."" Anne Collier at Galerie Neu in Berlin.
-jc.10.18.19 #
A post from the daily flow of linkage called Fresh Signals, at Coudal.com."
0.4389,0.0,0.928,0.072,"23. Oktober 2019 18:41 | #Musik#Musikvideos
Noch mehr neue Musikvideos mit SASSY 009, HUMANOID, Vegyn, Clipping, DATASSETTE, Holy Ghost!, JFDR, Negativland, James Hoff, 30/70, Steven A. Clark, Pod Blotz, Lucinda Chua, Klangstof und Prince Innocence. Hier mei… [+1114 chars]"
-0.5106,0.107,0.893,0.0,"23. Oktober 2019 18:36 | #Musik#Musikvideos
Neue Musikvideos mit Common Holly, Automatic, Frazey Ford, Michael Kiwanuka, Pumarosa, Destroyer, Grrrl Gang, Sorry, Matt Berninger, Glen Hansard, Gengahr, Sam Fender, Girl Ray und ein Live-Song der IDLES, sowie ne… [+1307 chars]"
-0.3612,0.1,0.848,0.052,"Svetlana approached me in July, their September artist needed to postpone, would I take the slot in place of my later one. I rejected the idea it was a pure, forceful reflex the time was too short. But a week later a yes began to form.
This became my premise… [+1495 chars]"
-0.8519,0.201,0.799,0.0,"Image copyrightpinstock/Getty Images
Posters should be displayed in schools warning against violence or threats to staff, a teaching conference will hear.
A motion to the National Education Union (NEU) Cymru conference calls for posters to be put up in rece… [+2797 chars]"
0.5553,0.05,0.832,0.119,"Sometimes there are unexpected mashups that just work. This mix of Harper from Stranger Things and the ’80s TV series, Magnum P.I., for example, is epically enjoyable, as is this Marvel Studios version of The Room. But while most of the bizarre mashups we’ve … [+1760 chars]"
-0.3818,0.058,0.942,0.0,"Außerdem ab Freitag neu: The Damned, Bob Dylan, Black Stone Cherry, Counterparts, Keith Jarrett, R.E.M., Long Distance Calling etc.
Konstanz (laut) - ""Über Camora kann man nix mehr sagen"", tönt es aus dem Snippet zu ""Zenit"" - angeblich ja das letzte Album, a… [+5993 chars]"
0.4404,0.039,0.85,0.111,"Sizeable price drop on this SSD at Amazon Germany. You can use your UK Amazon details to purchase. You must click under ""4 neu"" (shown in the image below) to purchase at the cheapest price. Credit - MydealzTHE SAMSUNG SSD 970 EVO
The Samsung SSD 970 EVO is t… [+1852 chars]"
-0.8979,0.199,0.801,0.0,"Jade Devis of Rancho Cucamonga, California, was only a few weeks into her pregnancy when she was diagnosed with a rare form of cancer — one that, doctors initially told her, meant that her baby would die if she underwent treatment to fight it.
“I did not kno… [+2471 chars]"
0.296,0.0,0.953,0.047,"About 6 years ago we came up with an unconventional funding idea. We decided that rather than selling share capital and control of a business in return for money to operate, we would instead sell goods and services in return for money to operate. As a result … [+3362 chars]"
0.0,0.0,1.0,0.0,"Collectives from over 27 countries will come to Berlin to participate in the awareness initiative on November 9th.
The Berlin Club Commission is hosting a European Club Night on the 30th anniversary of the fall of the Berlin Wall.
The goal of the initiative… [+1138 chars]"
0.6705,0.0,0.814,0.186,"Very Briefly Noted 2019-10-20: Zamzar: File Conversion Made Easy https://www.zamzar.com/... Josiah Ober (2009): Epistemic democracy in Classical Athens: Sophistication, Diversity, and Innovation https://www.princeton.edu/~pswpc/pdfs/ober/080901.pdf: ""Analysis… [+3768 chars]"
