Ticker,Name,Description,Price(USD),Start,End,ROI(Pct),Timezone,Duration
CMA,Coin Mine Australia,Australias First  Largest Crowd Funded Mining Operation,0.0,2018-04-16 08:00:00,2018-06-25 23:59:00,0.0,UTC+8,70 days 15:59:00.000000000
SAVG,Savage Token,The Savage Token project is a  democratized tokenized reputationbased stock media platform that rewards millions of digital content creators without the need for any central middlemen,0.0,2018-03-26 00:01:00,2018-06-26 23:59:00,0.0,UTC+0,92 days 23:58:00.000000000
ICST,ICST,ICST is a platform used to identity store and protect creative content using blockchain technology,0.0,2018-06-12 00:00:00,2018-06-29 00:00:00,0.0,UTC+0,17 days 00:00:00.000000000
PTH,PRETHER,PRETHER Cryptocurrency backed by Precious Metals to give intrinsic value to investors,0.0,2018-04-01 00:00:00,2018-06-30 00:00:00,0.0,UTC+1,90 days 00:00:00.000000000
ADM,ADAMANT Messenger,The most secure and anonymous messenger encrypted with Blockchain ADAMANT will bring a new user experience to messaging,0.0,2018-01-30 06:18:00,2018-06-30 06:19:00,0.0,UTC+3,151 days 00:01:00.000000000
WELL,WELL,Healthcare Delivered WELL With Blockchain technology WELL is set to revolutionize the healthcare industry,0.0,2018-04-16 08:00:00,2018-06-30 08:00:00,-0.9555,UTC+0,75 days 00:00:00.000000000
TRW,Triwer,Parcel Delivery with Precision and Speed Using Blockchain Technology for improved Efficiency,0.0,2018-06-01 12:00:00,2018-06-30 12:00:00,0.0,UTC+1,29 days 00:00:00.000000000
EQUI,EQUI,EQUI disrupts the traditional venture investment market by empowering the crypto community to join the next generation of venture capital investors,0.0,2018-03-15 13:00:00,2018-06-30 12:00:00,0.0,UTC+0,106 days 23:00:00.000000000
LTS,Lotus Core,The decentralized platform for gamers developers and investors,0.0,2018-05-30 13:00:00,2018-06-30 13:00:00,0.0,UTC+0,31 days 00:00:00.000000000
RAC,RoBET,RoBET is going to be the first platform for crypto sports betting and cryptocurrency exchange,0.0,2018-04-20 15:00:00,2018-06-30 15:00:00,0.0,UTC+0,71 days 00:00:00.000000000
GREM+GRET,Global REIT,The first ever Blockchain based Real Estate Investment Trust REIT to ensure profitable returns for subscribers,0.0,2018-06-01 17:00:00,2018-06-30 17:00:00,0.0,UTC+0,29 days 00:00:00.000000000
GBT,Globatalent,The sports marketplace where you can invest in your worldwide idols by making use of the magic of blockchain technology to present a transparent process,0.0,2018-06-18 00:00:00,2018-06-30 23:59:00,0.0,UTC+1,12 days 23:59:00.000000000
KON,Konios,The worlds most secure cash  crypto platform,0.0,2018-05-01 00:00:00,2018-06-30 23:59:00,0.0,UTC+1,60 days 23:59:00.000000000
AST,All-Stocks Network,The ALLSTOCKS Network is a distributed global stock exchange platform which aims to interface with all major stock exchanges and stock brokers around the world,0.0,2018-05-01 00:00:00,2018-06-30 23:59:00,0.0,UTC+2,60 days 23:59:00.000000000
CHIP,RealCasino,RealCasino is a decentralized distributed casino gaming platform,0.0,2018-05-01 17:00:00,2018-06-30 23:59:00,-0.917,UTC+0,60 days 06:59:00.000000000
PGC,Paygine,Paygine is an open financial platform designed to operate within its own proprietary banking structure and designed to serve cryptobusiness needs,0.0,2018-04-01 00:01:00,2018-06-30 23:59:00,0.0,UTC--5,90 days 23:58:00.000000000
TCH,Teacher Coin,Teacher Coin TCH Crypto Currency for Educators provides a Universal platform for Teachers to purchase and sell resources and plan for Retirement,0.0,2018-06-15 23:59:00,2018-06-30 23:59:00,0.0,UTC+8,15 days 00:00:00.000000000
TBT,TRIPBIT,The New Global Currency for Travel and Tourism,0.0,2018-05-01 00:00:00,2018-07-03 00:00:00,0.0,UTC+0,63 days 00:00:00.000000000
WINS,WinStars,Winstars is a decentralized gaming platform with a catalog of gambling resources the core is built on Blockchain and smart contracts,0.0,2018-06-03 00:01:00,2018-07-03 23:59:00,0.0,UTC+3,30 days 23:58:00.000000000
DZC,D-ZONE COIN,The worlds first settlement service using block chain technology that realizing low commission high security immediate settlement,0.0,2018-06-01 00:00:00,2018-07-04 23:59:00,0.0,UTC+9,33 days 23:59:00.000000000
DTX,DataBroker DAO,DataBroker DAO is the first marketplace to sell  buy sensor data through the use of Blockchain Technology,0.0,2018-04-26 16:00:00,2018-07-07 16:00:00,0.0,UTC+1,72 days 00:00:00.000000000
ESS,Essentia,Essentia is the interoperations and data management framework forged by a whole new set of protocols,0.0,2018-06-25 12:01:00,2018-07-08 12:00:00,-0.9887,UTC+0,12 days 23:59:00.000000000
CIF,CrowdIF,A revolutionary project using sentiment analysis for crypto trading through sophisticated algorithms,0.0,2018-06-25 12:00:00,2018-07-10 12:00:00,0.0,UTC+0,15 days 00:00:00.000000000
XSE,XSEARCH,XSEARCH  Innovating Research System using the power of blockchain technology,0.0,2018-06-10 14:00:00,2018-07-10 23:00:00,0.0,UTC+2,30 days 09:00:00.000000000
DTT,Delphi Technologies Token.,Smart wallet  Currency for Delphi Intelligent carsThis is a token used in Delphi intelligent  driverless cars for use by car,0.0,2018-05-01 17:00:00,2018-07-11 23:59:00,0.0,UTC+7,71 days 06:59:00.000000000
NH,Nihilum,A lifetime cloud mining service provider managed by a Danish company and a group of passionate professionals,0.0,2018-05-11 00:00:00,2018-07-11 23:59:00,0.0,UTC+3,61 days 23:59:00.000000000
MDX,Mandala,A revolutionary digital asset exchange which is simple secure and sustainable,0.0,2018-06-01 00:01:00,2018-07-13 23:59:00,0.0,UTC--5,42 days 23:58:00.000000000
FNT,Friend,Worlds first decentralised open source and device independent computer based on Blockchain Technology,0.0,2018-06-15 09:00:00,2018-07-14 09:00:00,0.0,UTC+0,29 days 00:00:00.000000000
ODY,Odyfund,Fundraising platform linked to a humanitarian crypto emergency fund,0.0,2018-06-15 12:00:00,2018-07-15 12:00:00,0.0,UTC+0,30 days 00:00:00.000000000
VRN,VERNAM,The Worlds First 0 commission insurance on the Blockchain  making insurance more affordable,0.0,2018-06-04 09:01:00,2018-07-15 23:59:00,0.0,UTC+0,41 days 14:58:00.000000000
ABCS,AbacasXchange,AbacasXchange is a universal exchange that allows you to trade exchange or transfer Any Asset Anywhere Anytime,0.0,2018-06-15 00:00:00,2018-07-15 23:59:00,0.0,UTC+0,30 days 23:59:00.000000000
BEAT,BEAT,BEAT is a SportAlliance project to help promote Sporting and Healthy activities,0.0,2018-02-21 00:00:00,2018-07-15 23:59:00,0.0,UTC+1,144 days 23:59:00.000000000
KEP,Kepler Technologies,Artificial Intelligence AI and Robotics Ecosystem Powered by Blockchain Technology,0.0,2018-06-26 00:00:00,2018-07-17 00:00:00,0.0,UTC+4,21 days 00:00:00.000000000
FTEC,FTEC,FTEC is an ecosystem of intelligent services and neural networks for conducting effective trading activities on cryptocurrency markets,0.0,2018-06-20 14:00:00,2018-07-18 14:00:00,0.0,UTC+0,28 days 00:00:00.000000000
PERA,PAYERA,A new era in the crypto world through simple shopping and easy payment,0.0,2018-06-20 18:00:00,2018-07-18 18:00:00,0.0,UTC+1,28 days 00:00:00.000000000
LUK,Luckchemy,Luckchemy is a scalable and provably fair online gambling platform driven by a unique combination of blockchain technology and offchain cryptography,0.0,2018-05-22 00:00:00,2018-07-20 23:59:00,0.0,UTC+0,59 days 23:59:00.000000000
GANA,GANA,The blockchain based AI platform providing personal assistance in cannabis industry,0.0,2018-05-21 00:00:00,2018-07-21 23:59:00,0.0,UTC+1,61 days 23:59:00.000000000
ATK,IAC AutoUnit,Decentralized marketplace with multilevel cashback,0.0,2018-03-26 12:00:00,2018-07-22 12:00:00,0.0,UTC+3,118 days 00:00:00.000000000
TYPE,Typerium,IP Protected contentcreation platform social media network and marketplace,0.0,2018-06-26 19:00:00,2018-07-23 23:59:00,0.0,UTC+1,27 days 04:59:00.000000000
YUM,Yumerium,Play review and Share to Earn on an open Gaming Platform which makes use of the Blockchain,0.0,2018-05-24 02:00:00,2018-07-24 02:00:00,0.0,UTC--8,61 days 00:00:00.000000000
TTV,TV-TWO,Television Ecosystem on the Blockchain which enables directs connection between viewers advertisers and content creators,0.0,2018-05-24 13:00:00,2018-07-24 13:00:00,0.0,UTC+0,61 days 00:00:00.000000000
REFER,Plentix,Connecting and rewarding participants in online referral programs power by Blockchain Technology,0.0,2018-07-11 12:00:00,2018-07-25 12:00:00,0.0,UTC+11,14 days 00:00:00.000000000
CHBR,CriptoHub,CriptoHub is a Brazilian cryptocurrency exchange bringing unique benefits Brazil,0.0,2018-04-20 00:00:00,2018-07-27 00:00:00,0.0,UTC--3,98 days 00:00:00.000000000
VLR,Valorem Foundation,Valorem Foundation is building a niche ecommerce platform for 99 of the market,0.03,2017-12-15 03:00:00,2018-07-28 03:00:00,-0.9813,UTC+0,225 days 00:00:00.000000000
COT,Coinet,Coinet Financing Platform is a decentralized P2P platform that will directly connect investors and project owners We will follow the DAICO model,0.0,2018-06-22 12:00:00,2018-07-28 12:00:00,0.0,UTC+0,36 days 00:00:00.000000000
AQUAX,IAqua,Expansion of sustainable freshwater aquaculture facility in Australia to grow premium quality fish,0.0,2018-04-29 01:00:00,2018-07-29 01:00:00,0.0,UTC+0,91 days 00:00:00.000000000
LBT,LendsBay,LendsBay is system for trusted financial transactions between people based on transparency and blockchain technology,0.0,2018-06-18 00:00:00,2018-07-29 23:59:00,0.0,UTC+3,41 days 23:59:00.000000000
AVINOC,Avinoc,The Blockchain Solution disrupting the global General Aviation Business,0.0,2018-07-14 00:00:00,2018-07-30 00:00:00,0.0,UTC+2,16 days 00:00:00.000000000
PT,Playtness,Tokenizing the world of fitness to create healthier lives for all around the globe using the power of blockchain technology,0.0,2018-07-01 12:00:00,2018-07-30 12:00:00,0.0,UTC+2,29 days 00:00:00.000000000
K2G,Kasko2go,First blockchain community for safer driving and help drive down car insurance costs,0.0,2018-07-01 12:01:00,2018-07-30 12:00:00,0.0,UTC+1,28 days 23:59:00.000000000
FLEX,TrustedCars Flex,AwardWinning German Company is changing Car Ownership forever by incorporating the magic of Blockchain Technology,0.0,2018-06-11 09:00:00,2018-07-30 23:00:00,0.0,UTC+2,49 days 14:00:00.000000000
DEC,Darico,Monitor Trade Invest Spend,0.1,2018-01-30 00:00:00,2018-07-30 23:59:00,-0.8056,UTC+1,181 days 23:59:00.000000000
C4F,Coins4Favors,A decentralized blockchain powered peertopeer platform for favors and minijobs around the world,0.0,2018-06-01 00:00:00,2018-07-30 23:59:00,0.0,UTC+0,59 days 23:59:00.000000000
FANZ,SportsCastr FanChain,Sports Token and Decentralized Ecosystem That Knows Your Favorite Team,0.0,2018-06-30 04:25:00,2018-07-31 04:25:00,0.0,UTC+2,31 days 00:00:00.000000000
XPR,PR Network,PRnetwork is an incentivebased voting protocol designed to decentralized the reputation and value of everything,0.0,2018-07-01 12:12:00,2018-07-31 12:12:00,0.0,UTC+0,30 days 00:00:00.000000000
BANG,Bounty Angels,A solution for Bounty hunters For ICO For blockchain community For everyone,0.0,2018-07-01 00:00:00,2018-08-01 00:00:00,0.0,UTC+0,31 days 00:00:00.000000000
LIC,Ligercoin,LIGER is here with best processes swifter transactions and smartest thinking Its advanced features of safety and anonymity are ready to win hearts and games,0.0,2018-06-17 09:00:00,2018-08-01 23:55:00,0.0,UTC+0,45 days 14:55:00.000000000
STAR,Starflow,Starflow is a blockchainpowered ecosystem for the influencer economy,0.0,2018-07-04 09:00:00,2018-08-04 09:00:00,0.0,UTC+1,31 days 00:00:00.000000000
DTN,Datareum,Decentralized Marketplace for Data helping data providers take control of their data,0.0,2018-06-02 12:00:00,2018-08-06 12:00:00,0.0,UTC+0,65 days 00:00:00.000000000
STM,STREAMITY,The key element of STREAMITY is StreamDesk decentralized application for exchange of cryptocurrency to fiat,0.0,2018-06-25 12:00:00,2018-08-06 12:00:00,0.0,UTC--8,42 days 00:00:00.000000000
BOTC,BotChain,Infrastructure for Trust and Audit of AI Systems It helps with increased adoption of AI,0.0,2018-07-08 17:40:00,2018-08-08 17:40:00,0.0,UTC--5,31 days 00:00:00.000000000
CODX,Codex Protocol,A decentralized registry for unique assets which makes use of Blockchain to verify and authenticate ownership of prized assets,0.0,2018-07-24 00:00:00,2018-08-08 23:59:00,0.0,UTC+0,15 days 23:59:00.000000000
MYDFS,MyDFS,Blockchainpowered daily fantasy sports which brings more efficiency for optimal user experience,0.0,2018-07-10 00:00:00,2018-08-10 23:59:00,0.0,UTC+0,31 days 23:59:00.000000000
MIB,MIB COIN,MIB coin is a smartphonebased Blockchain network which ensures efficient use of power through simplified coin mining,0.0,2018-07-20 00:00:00,2018-08-10 23:59:00,0.0,UTC+0,21 days 23:59:00.000000000
IC,INGOT Coin,Creating a onestopshop Ecosystem that will link the Crypto markets to the current financial markets,0.0,2018-07-01 00:00:00,2018-08-11 23:59:00,0.0,UTC+0,41 days 23:59:00.000000000
METM,MetaMorph Pro,Allinone Exchange to Secure Manage and Trade Cryptocurrencies It Presents Users with Convenience,0.0,2018-06-28 00:00:00,2018-08-14 00:00:00,0.0,UTC--5,47 days 00:00:00.000000000
B21,B21,Your personal wealth manager for cryptoassets to help maximize profits,0.0,2018-07-15 17:13:00,2018-08-14 17:14:00,0.0,UTC+0,30 days 00:01:00.000000000
HYB,Hybrid Betting,The unique platform in the world where betting is a different game,0.0,2018-06-14 12:00:00,2018-08-15 12:00:00,0.0,UTC+0,62 days 00:00:00.000000000
ASk,AllSpark,AllSpark Chain is a public blockchain where content creators advertisers and social media users coexist in a reciprocal sharing economy,0.0,2018-07-23 00:00:00,2018-08-15 23:59:00,0.0,UTC+0,23 days 23:59:00.000000000
Lamb,Lambda,A disruptor in blockchainbased storage solution The chain provides millions of Requests per Second RPS through sharding technology,0.0,2018-08-01 00:00:00,2018-08-15 23:59:00,0.0,UTC+8,14 days 23:59:00.000000000
TIP,Tip Blockchain,Powering mass adoption of cryptocurrency through discovery of information on the blockchain,0.0,2018-07-21 00:00:00,2018-08-17 23:59:00,0.0,UTC+0,27 days 23:59:00.000000000
OSA,OSA DC,The worlds first decentralized AIdriven marketplace providing realtime solutions to retailers manufacturers and consumers,0.0,2018-07-20 18:07:00,2018-08-20 18:07:00,0.0,UTC+0,31 days 00:00:00.000000000
ARTX,ArticleX,The first Publishing Platform for the Blockchain era  benefiting both publishers and visitors,0.0,2018-06-15 11:59:00,2018-08-20 23:59:00,0.0,UTC+0,66 days 12:00:00.000000000
IAM,IAME Identity,Making compromised information hackworthless It makes use of distributed ledger system to ensure that peoples identifications are secure,0.0,2018-07-04 00:01:00,2018-08-24 23:59:00,0.0,UTC+0,51 days 23:58:00.000000000
TRIL,Trilliant,Fractional Ownership Programs for Cryptocurrency ATMs Trilliant makes the highly lucrative cryptocurrency ATM business accessible to everyone,0.0,2018-08-11 00:00:00,2018-08-25 00:00:00,0.0,UTC+2,14 days 00:00:00.000000000
UBC,Ubcoin Market,Exchange Cryptocurrency for Real Goods and Vice VersaUbCoin makret makes a real life case for cryptocurrency transactions,0.0,2018-04-02 00:01:00,2018-08-27 23:59:00,0.0,UTC+0,147 days 23:58:00.000000000
LV,LendChain,LendChain is a distributed digital asset financial services platform based on the GXChain providing digital asset holders with financing investment insurance and other financial services,0.0,2018-08-28 12:00:00,2018-08-30 12:00:00,0.0,UTC+8,2 days 00:00:00.000000000
IOTW,IOTW,A cryptocurrency for IOT purchase supply chain and aftersales services transactions,0.0,2018-07-31 00:00:00,2018-08-31 00:00:00,0.0,UTC+8,31 days 00:00:00.000000000
GRAM,Lantah,Borderless marketplace connecting global trade and disrupting commerce giants through the implementation of Blockchain,0.0,2018-03-09 06:44:00,2018-08-31 06:44:00,0.0,UTC--4,175 days 00:00:00.000000000
TPLAY,TruePlay,Fully functioning platform created for integration of blockchain tech into online gambling projects,0.0,2018-05-15 00:00:00,2018-08-31 23:59:00,0.0,UTC+3,108 days 23:59:00.000000000
EO,EO.Trade,Leading Online Broker ExpertOption introduces the EO ecosystem EOTrade cryptoexchange EOFinance wallet and EONews portal,0.0,2018-07-16 09:00:00,2018-08-31 23:59:00,0.0,UTC+0,46 days 14:59:00.000000000
IMVR,ImmVRse,Decentralised platform for VR Content Creators Brands and Viewers by incorporating the power of Blockchain Technology,0.0,2018-07-07 00:00:00,2018-09-07 00:00:00,-0.9439,UTC+0,62 days 00:00:00.000000000
FYS,Fysical,Fysical is the infrastructure for the transparent and compliant exchange of location data,0.0,2018-09-03 00:00:00,2018-09-07 00:00:00,0.0,UTC+0,4 days 00:00:00.000000000
WEIS,WeiCrowd,End to end ICO lifecycle management and exchange solution with incubation Right Startups Right Funding And Right Growth,0.0,2018-05-15 00:00:00,2018-09-12 00:00:00,0.0,UTC+8,120 days 00:00:00.000000000
PAVO,Pavocoin,Pavo provides an intelligent stateoftheart IoT blockchain solution for the global agriculture ecosystem,0.0,2018-08-07 00:00:00,2018-09-15 00:00:00,0.0,UTC+0,39 days 00:00:00.000000000
MIC,DenchMusic,Dench Music ICO merges the Music Industry and Blockchain together to give music lovers the best experience,0.0,2018-08-15 00:00:00,2018-09-15 00:00:00,0.0,UTC+0,31 days 00:00:00.000000000
VIVA,Viva,Viva Easy simple and convenient way of Crowdfunding mortgages on the blockchain,0.0,2018-04-16 00:00:00,2018-09-18 00:00:00,0.0,UTC+0,155 days 00:00:00.000000000
MDBLX,MedBlox,Driving Health Care Innovation Through Patient Centric Interoperability,0.0,2018-08-19 20:00:00,2018-09-19 20:00:00,0.0,UTC--5,31 days 00:00:00.000000000
XCLP,Chynge,Worlds First Payment Token with No FX Risk Instant Free and Safe Payments with Smart Compliance,0.0,2018-06-28 00:00:00,2018-09-25 23:59:00,0.0,UTC+8,89 days 23:59:00.000000000
PPD,PingPaid,New payment system that uses any cryptocurrency or the PingPaid token to pay or receive payment on the blockchain for no or minimal fees,0.0,2018-07-01 00:00:00,2018-09-30 00:00:00,0.0,UTC--5,91 days 00:00:00.000000000
BXY,Beaxy Exchange,Beaxy aims to create the ultimate allinone cryptocurrency exchange with more tools at your disposal than ever before and a user experience that is unmatched,0.0,2018-09-01 00:00:00,2018-09-30 00:00:00,0.0,UTC+0,29 days 00:00:00.000000000
CCH,CitiCash,CitiCash is one of the worlds first cryptocurrencies that will enable the general public to enter the world of modern digital money with ease,0.0,2018-09-01 12:00:00,2018-09-30 00:00:00,0.0,UTC+2,28 days 12:00:00.000000000
TKD,Techrod,Revolutionizing ElectionsConsensus decision making Process,0.0,2018-03-12 12:00:00,2018-09-30 12:00:00,0.0,UTC+1,202 days 00:00:00.000000000
INV,Invest in Brokers,Social trustless copytrading through API services designed for beginning and experienced cryptocurrency traders,0.0,2018-08-15 12:00:00,2018-09-30 12:00:00,0.0,UTC+0,46 days 00:00:00.000000000
LXT,LEXIT,LEXIT is the first online marketplace that allows entrepreneurs to trade IP copyrights code and even sell entire startups,0.0,2018-06-19 00:01:00,2018-09-30 12:00:00,0.0,UTC+0,103 days 11:59:00.000000000
UBEX,Ubex,Ubex is a global decentralized advertising exchange where companies advertise effectively while publishers profitably tokenize ad slots on their resources,0.0,2018-05-21 14:00:00,2018-09-30 14:00:00,-0.9393,UTC+0,132 days 00:00:00.000000000
TUT,Tutellus,Tutellus is the biggest online educational collaborative platform in the Spanishspeaking world,0.0,2018-06-12 00:00:00,2018-09-30 23:59:00,0.0,UTC+0,110 days 23:59:00.000000000
TAB,Accounting Blockchain,The future of accounting saving businesses billions and sparing the individual sole reliance on expensive accountants,0.0,2018-07-15 10:00:00,2018-09-30 23:59:00,0.0,UTC+0,77 days 13:59:00.000000000
GBO,Gabro,GabroTech is Democratising loyalty rewards using Blockchain Technology This will disrupt the loyalty and rewards system,0.0,2018-07-31 00:00:00,2018-09-30 23:59:00,0.0,UTC+8,61 days 23:59:00.000000000
VOCO,Provoco,Provoco is the new generation of blockchainempowered social challenge network for mass users,0.0,2018-04-01 12:00:00,2018-10-01 12:00:00,0.0,UTC+0,183 days 00:00:00.000000000
RAWG,RAWG,RAWG is a Video game discovery platform that converts your skills into goods and services,0.0,2018-09-05 00:00:00,2018-10-05 00:00:00,0.0,UTC+0,30 days 00:00:00.000000000
VAD,Varanida,Building a better Internet through a decentralized advertising and content solution,0.0,2018-08-15 12:00:00,2018-10-06 12:00:00,0.0,UTC+1,52 days 00:00:00.000000000
AFI,Alchemy Coin,AFI is the first security token being backed by financial derivatives and powered by Blockchain Technology,0.0,2018-08-27 12:00:00,2018-10-09 00:00:00,0.0,UTC--5,42 days 12:00:00.000000000
MTC,Multiven MOM,The worlds first blockchainbased marketplace for the global 3 Trillion IT products and services Industry,0.0,2018-07-01 00:01:00,2018-10-09 23:59:00,0.0,UTC+1,100 days 23:58:00.000000000
AQUA,Sansox,The Power of Clean Water through the efficient use of technology powered by Blockchain,0.0,2018-09-10 19:00:00,2018-10-10 00:00:00,0.0,UTC+1,29 days 05:00:00.000000000
BDP,Bidipass,Secure identity for everyone through the application of blockchain technology which brings unrivaled transparency,0.0,2018-08-16 00:00:00,2018-10-11 00:00:00,0.0,UTC+0,56 days 00:00:00.000000000
UTS,UTEMIS,The First B2B ecommerce Token that Creates a Single Economic Space for Companies in Latin America To Regain New Net Growth,0.0,2018-09-16 17:00:00,2018-10-14 17:00:00,0.0,UTC+1,28 days 00:00:00.000000000
CNVT,Conventment,IoT B2B logistics for the legal cannabis industry powered by Ethereum,0.0,2018-09-30 00:00:00,2018-10-14 23:59:00,0.0,UTC--5,14 days 23:59:00.000000000
ZCN,ZICHAIN,Blockchain asset management ecosystem  An allinone investment tool,0.0,2018-09-01 00:00:00,2018-10-15 00:00:00,0.0,UTC+0,44 days 00:00:00.000000000
RSC,RONALDINHO SOCCER COIN,Creating a key coin for Soccer World and fusing the power of Blockchain Technology,0.0,2018-08-26 00:00:00,2018-10-17 00:00:00,0.0,UTC+0,52 days 00:00:00.000000000
PERL,Perlin,A supercomputer in the palm of your hand Perlin is a bleedingfast ledger with a powerful compute layer,0.0,2018-10-01 08:00:00,2018-10-26 23:59:00,0.0,UTC+1,25 days 15:59:00.000000000
PCX,Powerchain,Multifactorial solution for payment with cryptocurrencies and cryptotokens for realworld use,0.0,2018-09-21 09:00:00,2018-10-28 09:00:00,0.0,UTC+8,37 days 00:00:00.000000000
CCET,CCET Project,Extend renewable energy and blockchainify carbon emissions to solve problem,0.0,2018-09-30 00:00:00,2018-10-30 00:00:00,0.0,UTC+0,30 days 00:00:00.000000000
OHC,100Tokens,We believe that coin exchange value is strongly connected with its utilization strategy Thats why we propose you a coin which can be used as a payment option in at least 100 companies,0.0,2018-10-10 00:00:00,2018-10-30 23:59:00,0.0,UTC+0,20 days 23:59:00.000000000
SVP,Svper,Redefining Online Socializing by revolutionizing and revamping the space using Blockchain Technology,0.0,2018-10-01 00:00:00,2018-10-31 00:00:00,0.0,UTC+0,30 days 00:00:00.000000000
VBEO,Vibeo,A new Era of SocialInstant Messaging app which incorporates Blockchain Technology,0.0,2018-10-02 00:00:00,2018-10-31 00:00:00,0.0,UTC+0,29 days 00:00:00.000000000
SAM,SamBanx,Connecting cryptocurrency and digital assets to EU classic banks accounts,0.0,2018-10-01 00:00:00,2018-10-31 00:00:00,0.0,UTC+0,30 days 00:00:00.000000000
WZR,Wyzerr,Wyzerr will facilitate the turning of AI feedback data into tasks and insights for the different roles within a company,0.0,2018-10-01 00:00:00,2018-10-31 00:00:00,0.0,UTC+0,30 days 00:00:00.000000000
DNC,dona,dona Coin to make world a little bit better with donation using blockchain technology,0.0,2018-09-01 01:00:00,2018-10-31 09:00:00,0.0,UTC+0,60 days 08:00:00.000000000
CLB,Cloudbric,Secure your cryptocurrency and digital assets on the Blockchain with Cloudbric,0.0,2018-10-22 11:00:00,2018-10-31 11:00:00,0.0,UTC+0,9 days 00:00:00.000000000
GIZA,Giza Device,Hardware Wallet  Password Manager,0.0,2018-10-01 12:00:00,2018-10-31 12:00:00,0.0,UTC+0,30 days 00:00:00.000000000
CTKN,Curaizon,Improving Healthcare Reducing Costs  Saving Lives through the power of Blockchain Technology,0.0,2018-06-08 12:01:00,2018-10-31 12:00:00,0.0,UTC+0,144 days 23:59:00.000000000
8BT,8 Circuit Studios  Wave 2,We build video games digital assets and tools for blockchain that empower players and developers,0.0,2018-10-01 17:00:00,2018-10-31 23:59:00,0.0,UTC+0,30 days 06:59:00.000000000
BC,Boomstarter.Network,Blockchain to enable Startups to Make Money Worldwide and help with Revenue,0.0,2018-06-27 00:00:00,2018-10-31 23:59:00,0.0,UTC+3,126 days 23:59:00.000000000
GNY,GNY,Decentralized Machine Learning Platform making use of Blockchain Technology,0.0,2018-09-03 12:00:00,2018-11-01 12:00:00,0.0,UTC+0,59 days 00:00:00.000000000
RGL,Argyle Coin,Decentralized Marketplace for Diamonds using Blockchain Technology for an effective system,0.0,2018-09-17 13:00:00,2018-11-10 23:59:00,0.0,UTC+0,54 days 10:59:00.000000000
MET,Miner Edge,Miner Edge is a strategized diversified and crowdfunded mining facility,0.0,2018-08-28 00:00:00,2018-11-11 00:00:00,0.0,UTC+0,75 days 00:00:00.000000000
KGT,KamaGames Token Sale. Not an,KamaGames Tokens KGT is an industry first in providing ingame sales of services to its users,0.0,2018-10-08 12:00:00,2018-11-12 23:59:00,0.0,UTC+0,35 days 11:59:00.000000000
OGO,VogoV,Decentralized Porn Studio with a unified adultindustry cryptocurrency OGO coin that provides much more utility than just being a paymen,0.0,2018-09-26 12:00:00,2018-11-14 12:00:00,0.0,UTC+0,49 days 00:00:00.000000000
JUL,JULLAR,JULLAR project  The global eradication of Shitcoins from the cryptocurrency market,0.0,2018-08-20 00:00:00,2018-11-21 00:00:00,0.0,UTC+3,93 days 00:00:00.000000000
