Ticker,Name,Description,Price(USD),Start,End,ROI(Pct),Timezone,Duration
FSN,Fusion,Blockchain based inclusive cryptofinance platform,0.87,2018-02-01 12:00:00,2018-02-10 23:59:59,-0.6504000000000001,UTC+0,9 days 11:59:59.000000000
SCR,Scorum,Scorum is the first sports social media powered by blockchain,0.0,2018-01-14 16:00:00,2018-02-11 16:00:00,0.0,UTC+0,28 days 00:00:00.000000000
3DT,3D-Token,The glocal decentralized justintime factory 40,0.0,2017-12-18 00:00:00,2018-02-11 23:59:59,0.0,UTC+0,55 days 23:59:59.000000000
MWAT,REDMegaWatt,Major EU energy company launches energy trading ecosystem and the first power retail franchise,0.01,2018-01-15 12:00:00,2018-02-12 12:00:00,-0.8743000000000001,UTC+2,28 days 00:00:00.000000000
SKRP,Skraps,Invest your spare change into diversified portfolios of cryptocurrencies and crypto assets,0.0,2018-01-15 00:00:00,2018-02-14 11:59:59,0.0,UTC+0,30 days 11:59:59.000000000
DTH,Dether,Buy  sell crypto for cash Spend it at physical stores,0.0,2018-02-07 14:00:00,2018-02-14 14:00:00,-0.9909,UTC+1,7 days 00:00:00.000000000
DIGIT,DIGIT Coin,Empowering BlockchainBased Digital Marketing The Most Powerful Digital Marketing Solutions on Blockchain,0.0,2017-12-08 08:00:00,2018-02-14 23:00:00,0.0,UTC+7,68 days 15:00:00.000000000
IBET,cryptoibet,CryptoIBet is the next generation platform for online gaming experience,0.0,2017-12-01 00:00:00,2018-02-15 00:00:00,0.0,UTC+0,76 days 00:00:00.000000000
BMK,BMarkt,Futureoriented platorm for exchanging real objects for cryptocurrency,0.0,2018-01-15 00:00:00,2018-02-15 00:00:00,0.0,UTC+0,31 days 00:00:00.000000000
FXT,FuzeX,FuzeX offers an all in one payment solution that provides a smarter way to pay Paying with cryptocurrency debit credit and reward cards is easier,0.0,2018-01-15 00:00:00,2018-02-15 00:00:00,0.0,UTC+0,31 days 00:00:00.000000000
MAN,MATRIX,Matrix has been built as a distributed network of artificial intelligence and blockchain,0.53,2018-01-16 04:00:00,2018-02-15 04:00:00,0.48590000000000005,UTC+8,30 days 00:00:00.000000000
KRI,Krios,Decentralised digital marketing platform,0.0,2018-01-08 22:00:00,2018-02-16 22:00:00,0.0,UTC+0,39 days 00:00:00.000000000
REN,Republic Protocol,An opensource decentralized dark pool for trustless crosschain atomic trading of Ether ERC20 tokens and Bitcoin pairs,0.0,2018-02-03 13:56:00,2018-02-17 13:56:00,0.0,UTC+8,14 days 00:00:00.000000000
VB,VaultBank,A blueprint for disintermediated financial services,0.0,2017-12-13 00:00:00,2018-02-18 00:00:00,0.0,UTC+0,67 days 00:00:00.000000000
CLN,Colu Local Network,A decentralized payment system powered by everyday consumption,0.0,2018-02-14 14:00:00,2018-02-18 14:00:00,0.0,UTC+2,4 days 00:00:00.000000000
OTG,Outing,The first community app dedicated to events in real time that rewards users with its own cryptocurrency usable anywhere in the world,0.0,2018-01-08 00:00:00,2018-02-18 23:59:59,0.0,UTC+1,41 days 23:59:59.000000000
BTD,BITROAD,A modern solution for reliable global money transactions,0.75,2017-12-16 00:00:00,2018-02-20 00:00:01,-0.248,UTC+0,66 days 00:00:01.000000000
TKLN,Taklimakan Network,The Blockchain Investment Platform,0.0,2017-12-12 10:00:00,2018-02-20 10:00:00,0.0,UTC+0,70 days 00:00:00.000000000
BAX,BABB,Decentralised banking platform Access to a bank account for P2P financial services for anyone in the world,0.0,2018-02-06 08:33:00,2018-02-21 08:33:00,-0.9048,UTC+0,15 days 00:00:00.000000000
BFC,BioFactoryCoin,BioFactoryCoin BFC the first factory in the world producing healthy milk production with availability for cryptocurrency payments,0.0,2017-11-27 10:00:00,2018-02-21 22:00:00,0.0,UTC+0,86 days 12:00:00.000000000
CTN,Crypto Trust Network,Protecting you from cryptocurrency fraud,0.0,2018-01-22 18:00:00,2018-02-22 18:00:00,0.0,UTC+0,31 days 00:00:00.000000000
LWF,Local World Forwarders,Local World Forwarders is the first decentralized logistics platform based on the blockchain,0.0,2018-01-23 12:00:00,2018-02-23 12:00:00,0.0,UTC+0,31 days 00:00:00.000000000
OCN,Odyssey,ODYSSEYs mission is to build the nextgeneration decentralized sharing economy  Peer to Peer Ecosystem,0.0,2018-01-23 18:20:00,2018-02-23 18:27:00,0.0,UTC+0,31 days 00:07:00.000000000
iRMC,Remechain,A Global Market place for the safe and secure trading of secondary metals,0.0,2018-01-25 00:00:00,2018-02-25 23:59:59,0.0,UTC+0,31 days 23:59:59.000000000
HQX,HOQU,HOQU is the worlds first Decentralized Affiliate Platform,0.0,2017-11-27 00:00:00,2018-02-25 23:59:59,-0.9984999999999999,UTC+0,90 days 23:59:59.000000000
PIP,PayPro,The first decentralized financialmarketplace as a DAO using Blockchain Technology,0.0,2018-01-08 21:00:00,2018-02-26 21:00:00,0.0,UTC+0,49 days 00:00:00.000000000
SSH,StreamSpace,Blockchain powered Streaming Video on Demand Connecting content creators directly with consumers ,0.0,2018-01-15 11:00:00,2018-02-27 10:59:59,0.0,UTC--6,42 days 23:59:59.000000000
MRK,MARK.SPACE,MARKSPACE is worlds first opensource platform for creation of 3D VR and ARcompatible websites units and objects and for their fast integration into a single ecosystem The platform is Blockchainbased and supported by miners,0.0,2018-01-23 00:00:00,2018-02-28 00:00:00,-0.9825,UTC+0,36 days 00:00:00.000000000
RSN,RAISON,AI Platform for investment and personal finance,0.0,2018-02-01 00:00:00,2018-02-28 00:00:00,0.0,UTC+0,27 days 00:00:00.000000000
BERRY,Rentberry,Decentralized Home Rental Platform,0.0,2017-12-05 00:00:00,2018-02-28 00:00:00,-0.9979,UTC+0,85 days 00:00:00.000000000
STC,Stockchain Global,Stockchain Global brings a global blockchainbased platform to the market for issuance trading and management of financial instruments,0.0,2018-01-19 00:00:00,2018-02-28 00:00:00,0.0,UTC+0,40 days 00:00:00.000000000
MLT,MultiGames,The first gaming online casino based on Ethereum,0.0,2018-01-08 00:00:00,2018-02-28 00:00:00,0.0,UTC+0,51 days 00:00:00.000000000
HUR,Hurify,A Blockchain platform that aims to help SMEs build their IoT products  solution faster by connecting them to skilled IoT developers,0.0,2018-02-01 00:00:00,2018-02-28 00:00:00,0.0,UTC+0,27 days 00:00:00.000000000
CcS,CacaoShares,Saving the Future of Chocolate using the Blockchain,0.0,2018-02-14 00:00:00,2018-02-28 00:00:00,0.0,UTC+9,14 days 00:00:00.000000000
CID,Chain ID,Platform for keeping personal diplomas certificates and licenses in blockchain,0.0,2018-02-01 07:00:00,2018-02-28 07:00:00,0.0,UTC+0,27 days 00:00:00.000000000
DADI,DADI,A new era of cloud computing services powered by blockchain technology,0.06,2018-01-22 12:00:00,2018-02-28 12:00:00,-0.7696,UTC+0,37 days 00:00:00.000000000
LNC,Blocklancer,Blocklancer is a Decentralized Autonomous Job Market DAJ on the Ethereum platform,0.0,2018-01-16 13:00:00,2018-02-28 13:00:00,-0.9954999999999999,UTC+0,43 days 00:00:00.000000000
BBCoin,Tradove,Token based businesstobusiness B2B marketing sales and trade platform,0.0,2018-02-01 18:21:00,2018-02-28 18:21:00,0.0,UTC+0,27 days 00:00:00.000000000
VNX,Volinex,We make crypto easy,0.0,2017-12-15 20:00:00,2018-02-28 20:00:00,0.0,UTC+1,75 days 00:00:00.000000000
LCD,Lucyd,Join the Augmented Reality Revolution with Lucyd,0.0,2017-10-17 20:00:00,2018-02-28 20:00:00,0.0,UTC+0,134 days 00:00:00.000000000
DATx,DATx,A Blockchain Empowered Digital Advertising Terminal,0.0,2018-02-11 20:16:00,2018-02-28 20:16:00,0.0,UTC+8,17 days 00:00:00.000000000
CPX,Apex,APEX passes value and data ownership back to consumers increases marketing effectiveness data quality and customer loyalty,0.0,2018-01-29 22:31:00,2018-02-28 22:00:00,0.0,UTC+0,29 days 23:29:00.000000000
LYM,Lympo,Lympo is building an app a fitness wallet which will help people to reach their healthy lifestyle goals and earn tokens in return,0.0,2018-02-17 22:30:00,2018-02-28 22:31:00,-0.7826000000000001,UTC+0,11 days 00:01:00.000000000
NCASH,Nucleus.Vision,An IoTbased contactless identification system that empowers retailers to identify and better serve their customers,0.0,2018-02-26 23:00:00,2018-02-28 23:00:00,-0.9017000000000001,UTC+0,2 days 00:00:00.000000000
CS,CREDITS,CREDITS Cryptocurrency and Blockchain platform for the financial industry with more than 1 mln txsec and 001 sec for a transaction,0.11,2018-02-15 00:00:00,2018-02-28 23:59:00,0.5414,UTC+0,13 days 23:59:00.000000000
DEEX,DEEX,The first ever created decentralized platform for convenient cryptocurrency trading,0.0,2018-01-10 00:00:00,2018-02-28 23:59:00,0.0,UTC+0,49 days 23:59:00.000000000
VIOX,Vionex,Vionex is a revolutionary blockchainbased smart home system,0.0,2017-12-01 00:00:00,2018-02-28 23:59:59,0.0,UTC+0,89 days 23:59:59.000000000
MDC,MinerDog,MinerDog coin pays you monthly dividends in Ether from profits of our crypto mining operations,0.0,2017-12-17 00:00:00,2018-02-28 23:59:59,-1.0,UTC+0,73 days 23:59:59.000000000
NPX,NapoleonX,The first 100 algorithmic crypto asset manager,0.25,2018-01-22 12:00:00,2018-02-28 23:59:59,-0.7545000000000001,UTC+1,37 days 11:59:59.000000000
HAWK,CryptoHawk,The worlds first AllinOne solution for cryptocurrencies,0.01,2018-01-01 00:00:00,2018-02-28 23:59:59,-0.9799,UTC+1,58 days 23:59:59.000000000
KYC,KYC.LEGAL,KYCLEGAL is the identity verification platform on a blockchain,0.0,2017-11-29 00:00:00,2018-03-01 00:00:00,0.0,UTC+0,92 days 00:00:00.000000000
CBC,Corusblock,Corusblock is the next generation of cryptocurrency Lending staking mining in best performance This is Corusblock,0.01,2018-02-01 00:00:00,2018-03-01 00:00:00,-0.9872,UTC+0,28 days 00:00:00.000000000
WATR,WaterTech,Affordable clean water for everyone under the sun,0.0,2018-01-21 00:00:00,2018-03-01 00:00:00,0.0,UTC+0,39 days 00:00:00.000000000
MTN,MedicalChain,Blockchain technology for secure storage and transfer of electronic health records It provides the infrastructure for digital health applications,0.01,2018-02-01 00:00:00,2018-03-01 00:00:00,-0.9775,UTC+0,28 days 00:00:00.000000000
ECHT,e-Chat,Blockchainbased decentralized secure messenger and fastestgrowing social network,0.0,2018-01-08 12:00:00,2018-03-01 12:00:00,0.0,UTC+0,52 days 00:00:00.000000000
ELEC,Electrify.asia,ELECTRIFY is the first retail electricity marketplace in SoutheastAsia addressing the need for transparency and security,0.0,2018-02-13 21:25:00,2018-03-01 21:26:00,0.0,UTC+0,16 days 00:01:00.000000000
HBZ,Helbiz Coin,A Mobility Ecosystem set to reshape how we get from A to B making use of Blockchain Technology,0.0,2018-01-26 09:00:00,2018-03-04 09:00:00,0.0,UTC--5,37 days 00:00:00.000000000
DAN,Daneel,Daneel purpose is to bring data intelligence into the crypto jungle,0.0,2018-01-29 13:21:00,2018-03-05 13:21:00,0.0,UTC+0,35 days 00:00:00.000000000
IPSX,IP Sharing Exchange,IPSX is the first truly decentralized IP Sharing Exchange that will create a distributed network layer,0.0,2018-02-28 15:00:00,2018-03-05 15:00:00,0.0,UTC+2,5 days 00:00:00.000000000
J8T,Jet8,JET8 is a decentralized mobile engagement network connecting influencers audiences and brands through the value of social currency,0.0,2018-02-28 06:00:00,2018-03-06 23:59:00,-0.9964,UTC+0,6 days 17:59:00.000000000
HAV,Havven,A decentralised payment network and stable coin,0.25,2018-02-28 00:00:00,2018-03-06 23:59:00,-0.5064,UTC--8,6 days 23:59:00.000000000
SRNT,Serenity,The First Blockchain Escrow for Financial Markets,0.01,2018-01-25 00:00:00,2018-03-07 23:59:59,-0.9186,UTC+0,41 days 23:59:59.000000000
PHI,PHI Token,The Alibaba of Wealth Management PHI means Platform for Hybrid Investments but also Hybrid Platform for Investing,0.0,2018-03-03 08:00:00,2018-03-08 08:00:00,0.0,UTC+0,5 days 00:00:00.000000000
GRAM,Telegram,UltraFast Blockchain technology from Telegram messenger,0.0,2018-03-08 10:00:00,2018-03-08 11:00:00,0.0,UTC+0,0 days 01:00:00.000000000
DGZ,Dogezer,DoSoftwareTogether  Dogezer is a software development platform that allows team members to become product investors by investing their time and labor,0.0,2018-01-15 13:00:00,2018-03-08 13:00:00,0.0,UTC+0,52 days 00:00:00.000000000
OCN,Ocean protocol,Ocean Protocol is an ecosystem for sharing data and associated services,0.0,2018-03-07 01:07:00,2018-03-09 01:07:00,0.0,UTC+0,2 days 00:00:00.000000000
Ethix,Ethic Hub,Decentralized Crowdlending  Maximize returns from your money,0.0,2018-02-08 15:24:00,2018-03-09 15:24:00,0.0,UTC+1,29 days 00:00:00.000000000
SHA,Safe Haven,The first inheritable digital asset,0.0,2018-02-24 00:00:00,2018-03-10 00:00:00,-0.9976,UTC+0,14 days 00:00:00.000000000
CTF,Cryptotask,First fully scalable decentralized freelance task market,0.0,2018-02-03 12:00:00,2018-03-10 12:00:00,0.0,UTC+1,35 days 00:00:00.000000000
SCR,Scrinium,The future of portfolio investment,0.0,2018-02-11 00:00:00,2018-03-11 00:00:00,0.0,UTC+0,28 days 00:00:00.000000000
SPX,Sp8de,Sp8de is a blockchainbased platform capable of supplying unbiased public randomness for developing and running distributed gaming apps,0.04,2018-01-08 10:18:00,2018-03-11 10:18:00,3.056,UTC+0,62 days 00:00:00.000000000
LDC,LeadCoin,A Decentralized Lead Sharing Network The blockchain technology feature of the LeadCoin platform enables realtime lead sharing,0.0,2018-03-01 10:00:00,2018-03-11 12:59:00,-0.9967,UTC+2,10 days 02:59:00.000000000
CPT,Cryptaur,dApps launchpad and global marketplace without middlemen,0.0,2017-11-27 00:00:00,2018-03-12 00:00:00,0.0,UTC+0,105 days 00:00:00.000000000
RFR,Refereum,Refereum cuts out the marketing middleman by directly rewarding influencers and gamers to promote and play video games,0.0,2018-02-12 00:00:00,2018-03-12 00:00:00,-0.92,UTC+0,28 days 00:00:00.000000000
TT,TravelChain Project,DECENTRALIZED DATA EXCHANGE FOR THE TRAVEL INDUSTRY where travelers and businesses profit from sharing their info,0.0,2017-12-15 14:00:00,2018-03-12 14:00:00,0.0,UTC+0,87 days 00:00:00.000000000
ODDZ,MyOddz.bet,Ethereum Blockchain Betting  Gambling with Profit Share,0.0,2018-02-12 17:00:00,2018-03-12 17:00:00,0.0,UTC+0,28 days 00:00:00.000000000
PIIT,Prodeum,Tracking produce on the Ethereum blockchain,0.0,2018-01-20 01:00:00,2018-03-13 01:00:00,0.0,UTC--5,52 days 00:00:00.000000000
LUC,Play2live,The first decentralized streaming platform for gamers and eSports fans,0.0,2018-02-21 17:00:00,2018-03-14 17:00:00,0.0,UTC+0,21 days 00:00:00.000000000
VITO,VISO,VISO is a payment system that combines cryptocurrencies and traditional bank cards and terminals into one ecosystem,0.0,2017-11-25 00:00:00,2018-03-15 00:00:00,0.0,UTC+0,110 days 00:00:00.000000000
DRG,Dragon Inc,Bringing Gaming into the 21st Century,0.1,2018-02-15 08:00:00,2018-03-15 08:00:00,-0.978,UTC+0,28 days 00:00:00.000000000
MFG,SyncFab,Decentralized hardware manufacturing Syncfab helps to make use of Smart Manufacturing Blockchain,0.0,2018-02-15 08:00:00,2018-03-15 08:00:00,-0.9895999999999999,UTC+0,28 days 00:00:00.000000000
DNO,DENARO,Cryptocurrency wallet and worldwide debit cards,0.0,2018-02-09 12:00:00,2018-03-15 11:59:00,0.0,UTC+0,33 days 23:59:00.000000000
AIOM,AIOM,Medical analysis and research artificial intelligence application,0.0,2018-02-15 12:00:00,2018-03-15 12:00:00,0.0,UTC+2,28 days 00:00:00.000000000
XCD,Capdax,Capdax is one of the first exchanges that introduces premium customer service social trading and infrastructure stability,0.0,2018-02-17 05:00:00,2018-03-17 05:00:00,0.0,UTC+0,28 days 00:00:00.000000000
VLD,VALID,VALID is a fully integrated personal data management platform,0.0,2018-02-24 12:00:00,2018-03-17 12:00:00,0.0,UTC+0,21 days 00:00:00.000000000
EGL,eGold,The ultimate eSports betting cryptocurrency,0.0,2018-02-01 08:00:00,2018-03-18 20:00:00,0.0,UTC+0,45 days 12:00:00.000000000
NOAH,NOAH COIN,NOAHCOIN is Creating A Borderless World Through Blockchain to help empower people financially,0.0,2017-12-01 05:21:00,2018-03-19 05:21:00,-0.9906999999999999,UTC+0,108 days 00:00:00.000000000
GBX,Globitex,An institutionalgrade cryptocurrency exchange allowing everyone to trade commodities and money market instruments for Bitcoin,0.0,2018-02-10 17:00:00,2018-03-19 17:00:00,0.0,UTC+0,37 days 00:00:00.000000000
OPP,Opporty,Opporty is a decentralized service marketplace and selfregulated knowledgesharing community platform,0.0,2018-02-01 00:00:00,2018-03-20 00:00:00,0.0,UTC+0,47 days 00:00:00.000000000
ADH,AdHive,The first AIpowered platform for influencer marketing,0.0,2018-02-21 14:00:00,2018-03-21 14:00:00,0.0,UTC+0,28 days 00:00:00.000000000
VIEW,Viewly,Viewly is a decentralized video platform powered by blockchain and peertopeer video sharing technologies,0.0,2018-02-22 08:18:00,2018-03-22 08:18:00,0.0,UTC+0,28 days 00:00:00.000000000
CAPP,Cappasity,Decentralized ARVR ecosystem for 3D content exchange,0.0,2018-02-22 13:00:00,2018-03-22 13:00:00,-0.8569,UTC+0,28 days 00:00:00.000000000
ORI,Origami Network,BlockchainPowered global solution that builds decentralized online marketplaces faster and easier than current models,0.0,2018-02-23 13:19:00,2018-03-23 13:19:00,-0.9679000000000001,UTC+0,28 days 00:00:00.000000000
CNK,Crypto N Kafe,First coffee trading ecosystem entirely supporting smallscale farmers traders roasters and retailers,0.0,2018-01-18 11:00:00,2018-03-25 11:00:00,0.0,UTC+0,66 days 00:00:00.000000000
FUNDZ,FundFantasy,FundFantasy is an online social platform featuring peertopeer provablyfair simulated investing contests,0.0,2018-02-25 12:00:00,2018-03-25 12:00:00,0.0,UTC+0,28 days 00:00:00.000000000
VTP,Vestopia,Vestopia is a decentralized peertopeer investment ecosystem connecting the mass population to wealth and investment opportunities in an unprecedented model,0.0,2018-01-25 00:00:00,2018-03-26 00:00:00,0.0,UTC+0,60 days 00:00:00.000000000
XNT,Exenium,EXENIUM is a fullyfunctional cryptocurrency exchange implemented as a chatbot for messengers,0.0,2018-02-14 00:00:00,2018-03-26 00:00:00,0.0,UTC+0,40 days 00:00:00.000000000
YOU,SELFLLERY,The Social Platform for Visual Content Monetization,0.0,2018-03-05 12:00:00,2018-03-26 12:00:00,0.0,UTC+3,21 days 00:00:00.000000000
GIL,Gilgamesh,KnowledgeSharing social network platform powered by Ethereum Blockchain,0.0,2018-01-16 16:00:00,2018-03-26 16:00:00,0.0,UTC+0,69 days 00:00:00.000000000
BOOL,Booleancoin,Booleancoin Powers Boolean A News Accuracy Platform Aiming To Combat Fake News In The Media,0.0,2017-11-01 00:00:00,2018-03-27 00:00:00,0.0,UTC+0,146 days 00:00:00.000000000
NAC,Nami.trade,A blockchain broker which will bring no spread no swap and no commission to traders worldwide,0.0,2018-02-01 00:00:00,2018-03-28 23:59:00,0.0,UTC+7,55 days 23:59:00.000000000
WCO,Winco,Solutions for the decentralization of startups financing the franchise market and the real estate market,0.0,2018-02-19 06:14:00,2018-03-29 06:15:00,0.0,UTC--3,38 days 00:01:00.000000000
JOY,Joy Token,Joy Token is a new development platform specifically for the creation and marketing of online casino games,0.0,2018-02-27 17:00:00,2018-03-29 17:00:00,0.0,UTC+0,30 days 00:00:00.000000000
WIN,WAWLLET,Worlds first multiasset wallet and personal financial passport,0.0,2018-01-29 10:00:00,2018-03-30 09:59:00,-0.9998999999999999,UTC+0,59 days 23:59:00.000000000
CDG,CDG,Technology which covers the treatment process of raw domestic waste and green waste from agriculture,0.0,2018-03-15 12:00:00,2018-03-30 12:00:00,0.0,UTC+7,15 days 00:00:00.000000000
RQX,Requitix,Trusted Token and Confidence System,0.0,2018-02-20 00:00:01,2018-03-31 00:00:01,0.0,UTC+0,39 days 00:00:00.000000000
ESB,ENS.BID,ENSBID focuses on offering the best identity storage and domain name service to the decentralized world of Ethereum,0.0,2018-01-10 01:00:00,2018-03-31 01:00:00,0.0,UTC+0,80 days 00:00:00.000000000
WIKI,Wikibits,Be Part of the Next Generation Wiki,0.0,2017-12-15 05:00:00,2018-03-31 05:00:00,0.0,UTC+0,106 days 00:00:00.000000000
PITCH,Pitch,Entrepreneurs and Startups can Pitch Investors Live on the Platform,0.0,2018-02-28 05:55:00,2018-03-31 05:55:00,0.0,UTC+0,31 days 00:00:00.000000000
THT,Thought,Eliminate Traditional Applications with Data That Thinks,0.0,2018-03-01 09:00:00,2018-03-31 09:00:00,0.0,UTC--5,30 days 00:00:00.000000000
YUP,Crowdholding,A Decentralized Open Innovation platform that connects entrepreneurs and supporters,0.0,2017-11-01 10:00:00,2018-03-31 10:00:00,0.0,UTC+2,150 days 00:00:00.000000000
RNTB,BitRent,First decentralized Blockchain construction platform,0.0,2017-11-24 11:00:00,2018-03-31 11:00:00,-0.9987999999999999,UTC+0,127 days 00:00:00.000000000
BEEF,BeefCoin,Integrated production of organic beef from farm to table,0.0,2018-01-01 12:00:00,2018-03-31 12:00:00,0.0,UTC+0,89 days 00:00:00.000000000
FSBT,Forty Seven Bank,Forty Seven Bank is financial technology startup aimed at building a bridge between cryptocurrency world and the world of traditional monetary finance,0.15,2017-11-16 13:00:00,2018-03-31 13:00:00,-0.9079,UTC+0,135 days 00:00:00.000000000
HION,Handelion,Handelion is a revolutionary blockchain ecosystem for cofunded wholesale trade,0.0,2017-12-15 13:00:00,2018-03-31 13:00:00,0.0,UTC+2,106 days 00:00:00.000000000
RTB,AB-CHAIN,ABCHAIN ADVERTISING NETWORK  Blockchain and AI for enhanced campaigns,48.88,2018-02-19 09:00:00,2018-03-31 21:00:00,138.65709999999999,UTC+0,40 days 12:00:00.000000000
GES,Galaxy eSolutions,A global distribution and ecommerce marketplace for refurbished consumer electronics,0.0,2018-02-28 12:00:00,2018-03-31 23:59:00,0.0,UTC+0,31 days 11:59:00.000000000
Eroiy,Eroiy,The anonymous and safe payment method of the adult industry through the infusion of Blockchain,0.0,2018-01-30 00:00:00,2018-03-31 23:59:00,0.0,UTC+0,60 days 23:59:00.000000000
SKCH,Skychain,Blockchain infrastructure aimed to host train and use artificial intelligence AI in healthcare,0.0,2018-02-26 00:00:00,2018-03-31 23:59:00,0.0,UTC+1,33 days 23:59:00.000000000
XCLR,Clearcoin,ClearCoin is a technology company that powers the realtime buying and selling of media on decentralized applications and the broader digital environment,0.0,2017-11-16 00:00:01,2018-03-31 23:59:59,-0.9912000000000001,UTC--8,135 days 23:59:58.000000000
FT,Fabric Token,Draganddrop smart contracts,0.0,2018-02-15 10:00:00,2018-04-01 10:00:00,-0.9693,UTC+0,45 days 00:00:00.000000000
TCT,The Coffee Token,First and only global decentralized ecosystem directly connecting coffee producers and consumers using the blockchain technology,0.0,2018-02-14 10:00:00,2018-04-01 10:00:00,0.0,UTC--6,46 days 00:00:00.000000000
TrueCoin,True Reply,True Reply is the future of voicebased datacollection across IoT devices and telephones,0.0,2018-03-01 13:30:00,2018-04-01 13:30:00,0.0,UTC--5,31 days 00:00:00.000000000
IPC,PAYSURA,PAYSURA is providing the International PayReward Coin IPC in order to create a worldwide uniform reward system that applies the advantages of the Blockchain Technology,0.0,2018-03-03 13:00:00,2018-04-02 12:59:59,-0.9882,UTC+0,29 days 23:59:59.000000000
NKR,Nkor,Solving copyright issues forever,0.0,2018-03-03 00:00:00,2018-04-02 23:59:59,0.0,UTC+0,30 days 23:59:59.000000000
,HASHBUX,Decentralized online Gaming EcoSystem for Gamers,0.0,2018-03-26 15:00:00,2018-04-03 14:00:00,0.0,UTC+0,7 days 23:00:00.000000000
BITTO,BITTO Exchange,Bitcoin Exchange with 6 in 1 consisting of LendingStakingSignalReferralBorrowingTrading,0.0,2018-01-16 00:00:00,2018-04-03 23:59:59,0.0,UTC+0,77 days 23:59:59.000000000
ELET,Ether Legends (ELET),Ethereum Based Collectible Trading Card Game driven by the gaming platform token elementeum ELET,0.0,2018-02-15 00:00:00,2018-04-04 00:00:00,0.0,UTC+0,48 days 00:00:00.000000000
AMN,Amon,Enabling crypto spending in everyday life,0.0,2018-03-04 09:00:00,2018-04-04 09:00:00,0.0,UTC+0,31 days 00:00:00.000000000
VST,Vestarin,Cryptocurrency market place for goods and services,0.0,2018-03-05 12:00:00,2018-04-04 12:00:00,0.0,UTC+0,30 days 00:00:00.000000000
THRT,Thrive,Blockchainbased Decentralized Advertising Marketplace,0.0,2018-02-15 10:00:00,2018-04-05 10:00:00,0.0,UTC+0,49 days 00:00:00.000000000
R3S,R3SEC,Moving target defense  ultimate security on blockchain,0.0,2018-03-20 12:00:00,2018-04-05 12:00:00,0.0,UTC+0,16 days 00:00:00.000000000
REPUX,RepuX,RepuXs blockchainbacked platform enables Small and Medium Enterprises SMEs to securely sell their data,0.0,2018-03-06 06:17:00,2018-04-05 17:00:00,0.0,UTC+0,30 days 10:43:00.000000000
,Bank of Hash Power,The blockchain financial system guaranteed by Hash Power enable easiest access to crypto portfolio and trade settlement for EVERYONE,0.0,2018-03-07 00:00:00,2018-04-05 23:59:00,0.0,UTC+0,29 days 23:59:00.000000000
RTM,Renteum,Renteum is going to be the first of its kind to tie its token to realestate in Scandinavia and England,0.0,2018-01-04 00:00:00,2018-04-08 00:00:00,0.0,UTC+1,94 days 00:00:00.000000000
BLS,Bills,Bills is a technology that allows placing advertisements to an outdoor billboard located in any part of the world within a couple of minutes,0.0,2018-03-08 00:00:00,2018-04-08 00:00:00,0.0,UTC+0,31 days 00:00:00.000000000
SAT,Sandblock,Rewarding customers for their loyalty engagement and feedback using cryptocurrencies,0.0,2018-03-21 14:00:00,2018-04-08 15:00:00,0.0,UTC+1,18 days 01:00:00.000000000
VLB,VLB,The number one blockchain fuel for the transport industry,0.0,2018-02-05 12:00:00,2018-04-09 12:00:00,0.0,UTC+0,63 days 00:00:00.000000000
SGN,Signals Network,Data science marketplace to help you discover create and monetize cryptocurrency trading,0.0,2018-03-12 14:00:00,2018-04-09 14:00:00,0.0,UTC+0,28 days 00:00:00.000000000
GZR,Gizer,The real global gaming network,0.0,2018-03-16 12:00:00,2018-04-10 12:00:00,0.0,UTC+0,25 days 00:00:00.000000000
MDTK,MD Tokens,Creating a universal digital payment engine to power a smart secure and efficient healthcare ecosystem accessible anywhere at anytime,0.0,2018-03-10 16:00:00,2018-04-10 16:00:00,0.0,UTC+0,31 days 00:00:00.000000000
CC,CUBAAZ,Travel for a Blockchain Era  Pay for goods and services whiles enjoying great discounts,0.0,2018-01-05 23:59:00,2018-04-10 23:59:00,0.0,UTC+0,95 days 00:00:00.000000000
